[{
	"activo": true,
	"clave": "",
	"createdAt": "2015-03-13T07:54:54.905Z",
	"deuda": 0,
	"expiracion": "01/02/2017",
	"metodo": "Otro",
	"nombre": "Mi Mai / Caja Sala ",
	"objectId": "8dA4FKLyFD",
	"otro": "No Paga",
	"pago": 0,
	"pueblo": "Bm",
	"servicio": "Cajas",
	"telefono": "017874022810",
	"ultimo_pago": "2/3/2016 12:03 AM ($0.00) - Yai Toro",
	"unidades": 1,
	"updatedAt": "2016-02-03T04:04:12.765Z",
	"$$hashKey": "object:77"
}, {
	"activo": true,
	"clave": "",
	"createdAt": "2015-03-23T02:05:59.341Z",
	"deuda": 0,
	"expiracion": "01/02/2017",
	"metodo": "Otro",
	"nombre": "Mi Mai / Caja Cuarto",
	"objectId": "Stp77a8daY",
	"otro": "No Paga",
	"pago": 0,
	"pueblo": "BM",
	"servicio": "Cajas",
	"telefono": "117874022810",
	"ultimo_pago": "2/3/2016 12:03 AM ($0.00) - Yai Toro",
	"unidades": 1,
	"updatedAt": "2016-02-03T04:04:27.858Z",
	"$$hashKey": "object:78"
}, {
	"activo": true,
	"clave": "",
	"createdAt": "2015-12-03T15:08:04.974Z",
	"deuda": 0,
	"expiracion": "01/03/2016",
	"metodo": "Otro",
	"nombre": "Luis Claudio /Nuevo",
	"objectId": "QhleWGRtxi",
	"otro": "",
	"pago": 10,
	"pueblo": "Yabucoa",
	"servicio": "Cajas",
	"telefono": "017873401727",
	"unidades": 1,
	"updatedAt": "2015-12-03T15:08:04.974Z",
	"$$hashKey": "object:79"
}, {
	"activo": true,
	"clave": "",
	"createdAt": "2015-12-07T21:42:31.495Z",
	"deuda": 0,
	"expiracion": "01/04/2016",
	"metodo": "Otro",
	"nombre": "Maria Muller Vazquez / mariamulle",
	"objectId": "rCB2HfmeBF",
	"otro": "",
	"pago": 15,
	"pueblo": "Cidra",
	"servicio": "Roku",
	"telefono": "+1 (787) 595-0686",
	"unidades": 1,
	"updatedAt": "2015-12-07T21:42:31.495Z",
	"$$hashKey": "object:80"
}, {
	"activo": true,
	"clave": "",
	"createdAt": "2015-04-02T22:42:26.765Z",
	"deuda": 0,
	"expiracion": "01/08/2016",
	"metodo": "Otro",
	"nombre": "Arturo Francisco / Nuevo",
	"objectId": "ffEu03f7zS",
	"otro": "",
	"pago": 10,
	"pueblo": "Canovana",
	"servicio": "Cajas",
	"telefono": "017872411638",
	"ultimo_pago": "12/4/2015 11:51 AM ($10.00) - Awilda Hernandez",
	"unidades": 1,
	"updatedAt": "2015-12-04T15:52:20.219Z",
	"$$hashKey": "object:81"
}, {
	"activo": true,
	"clave": "",
	"createdAt": "2015-10-07T19:37:18.829Z",
	"deuda": 0,
	"expiracion": "01/15/2016",
	"metodo": "Ath Movil",
	"nombre": "Manuel Villafa~e Melendez",
	"objectId": "cNw5Xo4BT0",
	"otro": "",
	"pago": 15,
	"pueblo": "Caguas",
	"servicio": "Roku",
	"telefono": "+1 (787) 586-0479",
	"ultimo_pago": "12/11/2015 11:49 AM ($15.00) - Flor Rivera",
	"unidades": 1,
	"updatedAt": "2015-12-15T17:11:56.526Z"
}, {
	"activo": true,
	"clave": "",
	"createdAt": "2015-12-16T00:37:53.799Z",
	"deuda": 0,
	"expiracion": "01/16/2016",
	"metodo": "Ath Movil",
	"nombre": "Carlos Jimenez Acevedo ",
	"objectId": "hJWbVvhZGG",
	"otro": "",
	"pago": 15,
	"pueblo": "Cayey",
	"servicio": "Pix",
	"telefono": "*939-259-9920",
	"unidades": 1,
	"updatedAt": "2015-12-16T15:28:21.003Z"
}, {
	"activo": true,
	"clave": "",
	"createdAt": "2015-08-18T00:25:07.489Z",
	"deuda": 0,
	"expiracion": "01/18/2016",
	"metodo": "Otro",
	"nombre": "Samuel Diaz /Nuevo",
	"objectId": "89wbxBF9ei",
	"otro": "",
	"pago": 10,
	"pueblo": "Caguas",
	"servicio": "Cajas",
	"telefono": "017872026810",
	"ultimo_pago": "11/30/2015 4:56 PM ($10.00) - Awilda Hernandez",
	"unidades": 1,
	"updatedAt": "2015-11-30T20:57:15.674Z"
}, {
	"activo": true,
	"clave": "",
	"createdAt": "2015-12-18T16:39:35.765Z",
	"deuda": 0,
	"expiracion": "01/18/2016",
	"metodo": "Ath Movil",
	"nombre": "Jose Adorno Colon",
	"objectId": "cdefMqQsaj",
	"otro": "",
	"pago": 15,
	"pueblo": "Manati",
	"servicio": "Mach Tv",
	"telefono": "+1 (787) 566-3453",
	"unidades": 1,
	"updatedAt": "2015-12-18T16:39:35.765Z"
}, {
	"activo": true,
	"clave": "",
	"createdAt": "2015-12-18T17:45:00.818Z",
	"deuda": 0,
	"expiracion": "01/18/2016",
	"metodo": "Otro",
	"nombre": "Charlie Arroyo Figueroa / Nuevo",
	"objectId": "yhn4ImPbGg",
	"otro": "",
	"pago": 10,
	"pueblo": "Borinquen Caguas",
	"servicio": "Cajas",
	"telefono": "017873779696",
	"unidades": 1,
	"updatedAt": "2015-12-18T17:45:00.818Z"
}, {
	"activo": true,
	"clave": "",
	"createdAt": "2015-12-21T16:31:31.486Z",
	"deuda": 0,
	"expiracion": "01/21/2016",
	"metodo": "Paypal",
	"nombre": "Jaime Rosado Sotero",
	"objectId": "Cix7fV310a",
	"otro": "",
	"pago": 15,
	"pueblo": "Carolina",
	"servicio": "Pix",
	"telefono": "+1 (787) 309-7001",
	"unidades": 1,
	"updatedAt": "2015-12-21T16:31:31.486Z"
}, {
	"activo": true,
	"clave": "",
	"createdAt": "2015-08-18T16:55:50.162Z",
	"deuda": 0,
	"expiracion": "01/24/2016",
	"metodo": "Paypal",
	"nombre": "Jose Arroyo Guzman / Madeline Baez / Nuevo",
	"objectId": "rEETjYYjXO",
	"otro": "",
	"pago": 10,
	"pueblo": "San Lorenzo",
	"servicio": "Cajas",
	"telefono": "017876857066",
	"ultimo_pago": "10/19/2015 10:27 AM ($10.00) - Flor Rivera",
	"unidades": 1,
	"updatedAt": "2015-11-20T22:29:30.435Z"
}, {
	"activo": true,
	"clave": "",
	"createdAt": "2015-12-31T00:30:25.430Z",
	"deuda": 0,
	"expiracion": "01/30/2016",
	"metodo": "Paypal",
	"nombre": "Alejadro Zapata01",
	"objectId": "HLcGAS7Pwk",
	"otro": "",
	"pago": 15,
	"pueblo": "Florida USA",
	"servicio": "Mach Tv",
	"telefono": "+1 (787) 630-6890",
	"unidades": 1,
	"updatedAt": "2015-12-31T00:30:25.430Z"
}, {
	"activo": true,
	"clave": "",
	"createdAt": "2016-01-04T19:39:30.786Z",
	"deuda": 0,
	"expiracion": "02/04/2016",
	"metodo": "Ath Movil",
	"nombre": "Katiana Correa Pagan ",
	"objectId": "qNOaX4TG8w",
	"otro": "",
	"pago": 15,
	"pueblo": "Morovis",
	"servicio": "Pix",
	"telefono": "+1 (787) 402-9434",
	"unidades": 1,
	"updatedAt": "2016-01-04T19:39:30.786Z"
}, {
	"activo": true,
	"clave": "",
	"createdAt": "2015-03-22T21:33:04.059Z",
	"deuda": 0,
	"expiracion": "02/06/2017",
	"metodo": "Ath Movil",
	"nombre": "Carlos Jimenez Acevedo / Nuevo",
	"objectId": "Xftgv8KddD",
	"otro": "",
	"pago": 10,
	"pueblo": "Cayey",
	"servicio": "Cajas",
	"telefono": "019392599920",
	"ultimo_pago": "2/4/2016 6:45 PM ($90.00) - Awilda Hernandez",
	"unidades": 1,
	"updatedAt": "2016-02-04T22:46:36.095Z"
}, {
	"activo": true,
	"clave": "",
	"createdAt": "2016-01-08T17:09:18.273Z",
	"deuda": 0,
	"expiracion": "02/08/2016",
	"metodo": "Ath Movil",
	"nombre": "Luz E Vazquez",
	"objectId": "1ivhLS8R9J",
	"otro": "",
	"pago": 15,
	"pueblo": "Florida",
	"servicio": "Mach Tv",
	"telefono": "+1 (787) 503-9591",
	"unidades": 1,
	"updatedAt": "2016-01-08T17:09:18.273Z"
}, {
	"activo": true,
	"clave": "",
	"createdAt": "2016-01-11T22:53:48.560Z",
	"deuda": 0,
	"expiracion": "02/11/2016",
	"metodo": "Otro",
	"nombre": "Virginia Galarza",
	"objectId": "vFTdNbYWwW",
	"otro": "",
	"pago": 15,
	"pueblo": "Gurabo",
	"servicio": "Pix",
	"telefono": "+1 (787) 579-0433",
	"unidades": 1,
	"updatedAt": "2016-01-11T22:53:48.560Z"
}, {
	"activo": true,
	"clave": "",
	"createdAt": "2016-01-12T00:33:48.173Z",
	"deuda": 0,
	"expiracion": "02/11/2016",
	"metodo": "Paypal",
	"nombre": "Antonio Figueroa / Elisa Rios",
	"objectId": "mfbElDpYp8",
	"otro": "",
	"pago": 15,
	"pueblo": "Ciales",
	"servicio": "Pix",
	"telefono": "+1 (787) 237-3601",
	"unidades": 1,
	"updatedAt": "2016-01-12T00:33:48.173Z"
}, {
	"activo": true,
	"clave": "",
	"createdAt": "2016-01-12T19:42:28.887Z",
	"deuda": 0,
	"expiracion": "02/12/2016",
	"metodo": "Ath Movil",
	"nombre": "Pedro Collazo / Waleska Marie Collazo",
	"objectId": "WL9HoE1eRI",
	"otro": "",
	"pago": 15,
	"pueblo": "Aibonito",
	"servicio": "Pix",
	"telefono": "+1 (787) 319-1455",
	"unidades": 1,
	"updatedAt": "2016-01-12T19:42:28.887Z"
}, {
	"activo": true,
	"clave": "",
	"createdAt": "2015-03-20T21:33:40.252Z",
	"deuda": 0,
	"expiracion": "02/14/2016",
	"metodo": "Otro",
	"nombre": "Mr Inti / Ivone Martinez / Nuevo",
	"objectId": "ZjjAIf2Abl",
	"otro": "Ath Movil, Personal en BM",
	"pago": 10,
	"pueblo": "Hac San Jose, Caguas, Bm",
	"servicio": "Cajas",
	"telefono": "017873740598",
	"ultimo_pago": "12/14/2015 4:37 PM ($10.00) - Yai Toro",
	"unidades": 1,
	"updatedAt": "2015-12-14T20:37:03.415Z"
}, {
	"activo": true,
	"clave": "",
	"createdAt": "2016-01-15T21:34:33.982Z",
	"deuda": 0,
	"expiracion": "02/15/2016",
	"metodo": "Paypal",
	"nombre": "Cesar Lebron",
	"objectId": "IjbA7MoHhY",
	"otro": "",
	"pago": 15,
	"pueblo": "Bayamon",
	"servicio": "Pix",
	"telefono": "+1 (939) 216-3325",
	"unidades": 1,
	"updatedAt": "2016-01-15T21:34:33.982Z"
}, {
	"activo": true,
	"clave": "",
	"createdAt": "2016-01-18T19:37:17.691Z",
	"deuda": 0,
	"expiracion": "02/18/2016",
	"metodo": "Ath Movil",
	"nombre": "Daiane Vega",
	"objectId": "2csf2kCE22",
	"otro": "",
	"pago": 15,
	"pueblo": "Morovis",
	"servicio": "Pix",
	"telefono": "+1 (787) 306-9244",
	"unidades": 1,
	"updatedAt": "2016-01-18T19:37:17.691Z"
}, {
	"activo": true,
	"clave": "",
	"createdAt": "2015-05-15T22:49:35.426Z",
	"deuda": 0,
	"expiracion": "02/20/2016",
	"metodo": "Personal",
	"nombre": "Manuel Rojas / Nuevo",
	"objectId": "m8M4ktZmoG",
	"otro": "",
	"pago": 10,
	"pueblo": "Caguas",
	"servicio": "Cajas",
	"telefono": "017875488341",
	"ultimo_pago": "12/14/2015 2:33 PM ($20.00) - Flor Rivera",
	"unidades": 1,
	"updatedAt": "2015-12-14T18:33:45.331Z"
}, {
	"activo": true,
	"clave": "",
	"createdAt": "2015-03-23T01:18:01.415Z",
	"deuda": 0,
	"expiracion": "02/21/2016",
	"metodo": "Ath Movil",
	"nombre": "Juan Pedraza Montañez / Nuevo",
	"objectId": "QkhZWyP6Sl",
	"otro": "",
	"pago": 10,
	"pueblo": "Humacao",
	"servicio": "Cajas",
	"telefono": "017872098860",
	"unidades": 1,
	"updatedAt": "2016-01-21T17:55:19.020Z"
}, {
	"activo": true,
	"clave": "",
	"createdAt": "2015-11-06T21:01:49.250Z",
	"deuda": 0,
	"expiracion": "02/27/2016",
	"metodo": "Personal",
	"nombre": "Pedro Nieves00",
	"objectId": "VFH4f7iibT",
	"otro": "",
	"pago": 10,
	"pueblo": "Caguas",
	"servicio": "Pix",
	"telefono": "*7874698473",
	"ultimo_pago": "12/8/2015 12:25 PM ($10.00) - Flor Rivera",
	"unidades": 1,
	"updatedAt": "2016-01-27T20:39:04.472Z"
}, {
	"activo": true,
	"clave": "",
	"createdAt": "2015-06-02T22:15:20.601Z",
	"deuda": 0,
	"expiracion": "02/29/2016",
	"metodo": "Otro",
	"nombre": "Pedro Nieves001",
	"objectId": "mUPR4tmivd",
	"otro": "",
	"pago": 15,
	"pueblo": "Caguas",
	"servicio": "Pix",
	"telefono": "+1 (787) 469-8473",
	"ultimo_pago": "12/8/2015 12:25 PM ($15.00) - Flor Rivera",
	"unidades": 1,
	"updatedAt": "2016-01-27T20:38:47.110Z"
}, {
	"activo": true,
	"clave": "",
	"createdAt": "2015-03-13T07:54:54.512Z",
	"deuda": 0,
	"expiracion": "03/01/2016",
	"metodo": "Correo",
	"nombre": "Jose Miranda / Nuevo",
	"objectId": "IS2csPyRZa",
	"otro": "",
	"pago": 10,
	"pueblo": "Aibonito, Coamo",
	"servicio": "Cajas",
	"telefono": "017874877705",
	"ultimo_pago": "9/7/2015 9:43 AM Acreditado 1 mes - Yai Toro",
	"unidades": 1,
	"updatedAt": "2015-11-02T17:56:04.258Z"
}, {
	"activo": true,
	"clave": "",
	"createdAt": "2015-11-23T21:18:39.528Z",
	"deuda": 0,
	"expiracion": "03/01/2016",
	"metodo": "Otro",
	"nombre": "Alexis Ramirez Rosario ",
	"objectId": "zrnoN9myNS",
	"otro": "Se le dio 1 crédito por Pedro Juan Rivera 11/24/15.",
	"pago": 15,
	"pueblo": "Humacao",
	"servicio": "Pix",
	"telefono": "+1 (787) 368-6920",
	"ultimo_pago": "1/29/2016 6:36 PM ($15.00) - Awilda Hernandez",
	"unidades": 1,
	"updatedAt": "2016-02-26T21:49:54.233Z"
}, {
	"activo": true,
	"clave": "",
	"createdAt": "2016-01-28T23:36:06.667Z",
	"deuda": 0,
	"expiracion": "03/01/2017",
	"metodo": "Personal",
	"nombre": "Maria Ruiz",
	"objectId": "cMsR1sttJe",
	"otro": "",
	"pago": 10,
	"pueblo": "Caguas",
	"servicio": "Cajas",
	"telefono": "017874600516",
	"ultimo_pago": "2/29/2016 10:10 AM ($90.00) - Flor Rivera",
	"unidades": 1,
	"updatedAt": "2016-02-29T14:16:37.852Z"
}, {
	"activo": true,
	"clave": "",
	"createdAt": "2016-02-02T19:48:58.488Z",
	"deuda": 0,
	"expiracion": "03/02/2016",
	"metodo": "Personal",
	"nombre": "Iara Gonzalez / Angel",
	"objectId": "OEw5QjrJbT",
	"otro": "",
	"pago": 35,
	"pueblo": "El Pueblo, Caguas",
	"servicio": "Internet 5M",
	"telefono": "787-943-8925 / 787-479-4623",
	"unidades": 1,
	"updatedAt": "2016-02-02T19:48:58.488Z"
}, {
	"activo": true,
	"clave": "",
	"createdAt": "2015-04-04T16:28:39.064Z",
	"deuda": 0,
	"expiracion": "03/05/2016",
	"metodo": "Otro",
	"nombre": "Awilda Pagan Acevedo // 10/30/15 le di en PIX 2 crédito de mas se le vence 01/02/2016.",
	"objectId": "jVLLYQofDO",
	"otro": "Paypal se le dio credito por Genesis Rivera 9/30/15// Se le dio 2 crédito por Carlos Resto y Sonia Rivera 10/30/2015.",
	"pago": 15,
	"pueblo": "Manati",
	"servicio": "Pix",
	"telefono": "+1 (787) 367-0809",
	"ultimo_pago": "1/31/2016 12:59 PM ($15.00) - Yai Toro",
	"unidades": 1,
	"updatedAt": "2016-01-31T17:01:10.709Z"
}, {
	"activo": true,
	"clave": "",
	"createdAt": "2015-11-04T21:00:18.340Z",
	"deuda": 0,
	"expiracion": "03/05/2016",
	"metodo": "Paypal",
	"nombre": "Laureano Gonzalez Muriel /2do roku / Laureano01",
	"objectId": "Nk0Jx1Zkrc",
	"otro": "",
	"pago": 15,
	"pueblo": "Carolina",
	"servicio": "Roku",
	"telefono": "787-226-2274 ó 787-598-8989",
	"ultimo_pago": "1/4/2016 8:58 PM ($15.00) - Awilda Hernandez",
	"unidades": 1,
	"updatedAt": "2016-02-29T23:43:43.205Z"
}, {
	"activo": true,
	"clave": "",
	"createdAt": "2016-01-04T22:33:49.395Z",
	"deuda": 0,
	"expiracion": "03/05/2016",
	"metodo": "Ath Movil",
	"nombre": "Ines Figueroa Soto / Zulma Soto",
	"objectId": "vzabZhEFGQ",
	"otro": "",
	"pago": 15,
	"pueblo": "Rio Grande ",
	"servicio": "Pix",
	"telefono": "+1 (787) 478-4010",
	"ultimo_pago": "2/4/2016 5:29 PM ($15.00) - Awilda Hernandez",
	"unidades": 1,
	"updatedAt": "2016-02-29T18:32:40.465Z"
}, {
	"activo": true,
	"clave": "",
	"createdAt": "2016-02-05T13:40:53.631Z",
	"deuda": 0,
	"expiracion": "03/05/2016",
	"metodo": "Ath Movil",
	"nombre": "Nestor Gonzalez Feliciano",
	"objectId": "0U2O5LKY7R",
	"otro": "",
	"pago": 15,
	"pueblo": "Humacao",
	"servicio": "Mach Tv",
	"telefono": "+1 (787) 340-8376",
	"unidades": 1,
	"updatedAt": "2016-02-05T13:40:53.631Z"
}, {
	"activo": true,
	"clave": "",
	"createdAt": "2016-02-05T20:39:15.581Z",
	"deuda": 0,
	"expiracion": "03/05/2016",
	"metodo": "Otro",
	"nombre": "Hector Aviles",
	"objectId": "uvIFWSXg1v",
	"otro": "",
	"pago": 10,
	"pueblo": "Bayamon",
	"servicio": "Cajas",
	"telefono": "017873788062",
	"unidades": 1,
	"updatedAt": "2016-02-05T20:39:15.581Z"
}, {
	"activo": true,
	"clave": "",
	"createdAt": "2016-02-06T00:33:23.011Z",
	"deuda": 0,
	"expiracion": "03/05/2016",
	"metodo": "Paypal",
	"nombre": "Hasha Hines Bernal",
	"objectId": "s7ehIO7zms",
	"otro": "",
	"pago": 15,
	"pueblo": "Guaynabo",
	"servicio": "Mach Tv",
	"telefono": "+1 (787) 432-3026",
	"unidades": 1,
	"updatedAt": "2016-02-06T00:33:23.011Z"
}, {
	"activo": true,
	"clave": "",
	"createdAt": "2015-03-13T07:54:54.832Z",
	"deuda": 0,
	"expiracion": "03/06/2016",
	"metodo": "Paypal",
	"nombre": "Jose Davila / Milena Davila / Nuevo",
	"objectId": "IrGGtvG0HW",
	"otro": "",
	"pago": 10,
	"pueblo": "La Mesa, La Estrella,Caguas",
	"servicio": "Cajas",
	"telefono": "017875314834",
	"ultimo_pago": "2/3/2016 12:10 AM ($10.00) - Yai Toro",
	"unidades": 1,
	"updatedAt": "2016-02-03T04:13:45.528Z"
}, {
	"activo": true,
	"clave": "",
	"createdAt": "2015-08-28T21:55:48.572Z",
	"deuda": 0,
	"expiracion": "03/06/2016",
	"metodo": "Ath Movil",
	"nombre": "Yazmary Perez Camacho / Yazmary00 /1er Roku",
	"objectId": "ypAFdp5RDa",
	"otro": "",
	"pago": 10,
	"pueblo": "Caguas",
	"servicio": "Pix",
	"telefono": "*787-566-7543",
	"ultimo_pago": "2/4/2016 11:19 PM ($10.00) - Yai Toro",
	"unidades": 1,
	"updatedAt": "2016-02-05T03:21:04.179Z"
}, {
	"activo": true,
	"clave": "",
	"createdAt": "2015-08-28T21:57:01.818Z",
	"deuda": 0,
	"expiracion": "03/06/2016",
	"metodo": "Ath Movil",
	"nombre": "Yazmary Perez",
	"objectId": "cBnZ6A1AJ3",
	"otro": "",
	"pago": 25,
	"pueblo": "Caguas",
	"servicio": "Internet 3M",
	"telefono": "+1 (787) 566-7543",
	"ultimo_pago": "2/4/2016 11:20 PM ($25.00) - Yai Toro",
	"unidades": 1,
	"updatedAt": "2016-02-05T03:21:15.813Z"
}, {
	"activo": true,
	"clave": "",
	"createdAt": "2016-02-09T21:21:05.995Z",
	"deuda": 0,
	"expiracion": "03/06/2016",
	"metodo": "Otro",
	"nombre": "Freddy Gonzalez / Nuevo",
	"objectId": "lxBlhi5KDZ",
	"otro": "",
	"pago": 10,
	"pueblo": "Aguas Buenas",
	"servicio": "Cajas",
	"telefono": "017873889473",
	"unidades": 1,
	"updatedAt": "2016-02-09T21:21:05.995Z"
}, {
	"activo": true,
	"clave": "",
	"createdAt": "2016-02-14T00:49:39.314Z",
	"deuda": 0,
	"expiracion": "03/06/2016",
	"metodo": "Otro",
	"nombre": "Lourdes Flores Perez / Nuevo",
	"objectId": "n9IZVezCLB",
	"otro": "",
	"pago": 10,
	"pueblo": "Caguas",
	"servicio": "Cajas",
	"telefono": "017877466750",
	"unidades": 1,
	"updatedAt": "2016-02-14T00:49:39.314Z"
}, {
	"activo": true,
	"clave": "",
	"createdAt": "2015-06-07T00:48:58.922Z",
	"deuda": 0,
	"expiracion": "03/07/2016",
	"metodo": "Otro",
	"nombre": "Dennis Febles Fernandez / dennisfebl",
	"objectId": "HTjRVcaEls",
	"otro": "Se le dio 1 credito por Hector Rivera hasta 08/06/15///1credito por Angel Arocho 08/04/15 hasta 09/06/15. Se le dio 1 credito por Alexander Mojica (Se le dio 1 credito por Jean carlos Santiago 02/01/16 )",
	"pago": 15,
	"pueblo": "Bairoa Caguas",
	"servicio": "Roku",
	"telefono": "+1 (787) 374-6220",
	"ultimo_pago": "2/1/2016 3:54 PM Acreditado 2 meses - Awilda Hernandez",
	"unidades": 1,
	"updatedAt": "2016-02-01T19:54:46.836Z"
}, {
	"activo": true,
	"clave": "",
	"createdAt": "2016-01-05T18:23:34.149Z",
	"deuda": 0,
	"expiracion": "03/07/2016",
	"metodo": "Paypal",
	"nombre": "Gilberto Galloza00",
	"objectId": "51KlRecqsD",
	"otro": "",
	"pago": 15,
	"pueblo": "Florida EU",
	"servicio": "Mach Tv",
	"telefono": "*9734133247",
	"ultimo_pago": "2/5/2016 12:33 AM ($15.00) - Yai Toro",
	"unidades": 1,
	"updatedAt": "2016-02-05T04:34:13.177Z"
}, {
	"activo": true,
	"clave": "",
	"createdAt": "2015-05-02T17:14:12.948Z",
	"deuda": 0,
	"expiracion": "03/08/2016",
	"metodo": "Personal",
	"nombre": "Efrain Acevedo Cruz / Pipo",
	"objectId": "y2sxYg6oql",
	"otro": "",
	"pago": 10,
	"pueblo": "Aguas Buenas",
	"servicio": "Pix",
	"telefono": "+1 (787) 557-0879",
	"ultimo_pago": "1/19/2016 7:03 AM ($10.00) - Yai Toro",
	"unidades": 1,
	"updatedAt": "2016-01-19T11:05:29.546Z"
}, {
	"activo": true,
	"clave": "",
	"createdAt": "2016-02-08T18:09:31.803Z",
	"deuda": 0,
	"expiracion": "03/08/2016",
	"metodo": "Ath Movil",
	"nombre": "Evelyn Rodriguez",
	"objectId": "At9MmTx8PK",
	"otro": "",
	"pago": 10,
	"pueblo": "Carolina",
	"servicio": "Cajas",
	"telefono": "017872386446",
	"unidades": 1,
	"updatedAt": "2016-02-08T18:09:31.803Z"
}, {
	"activo": true,
	"clave": "",
	"createdAt": "2016-02-08T19:31:52.556Z",
	"deuda": 0,
	"expiracion": "03/08/2016",
	"metodo": "Ath Movil",
	"nombre": "Tania Denisse Maldonado Torres",
	"objectId": "IRePFu9iwQ",
	"otro": "",
	"pago": 15,
	"pueblo": "Bayamon",
	"servicio": "Roku",
	"telefono": "+1 (787) 475-0307",
	"unidades": 1,
	"updatedAt": "2016-02-08T19:31:52.556Z"
}, {
	"activo": true,
	"clave": "",
	"createdAt": "2016-02-08T22:20:07.930Z",
	"deuda": 0,
	"expiracion": "03/08/2016",
	"metodo": "Otro",
	"nombre": "Wilfredo Cruz Rivera / Nuevo",
	"objectId": "EKwZV8631p",
	"otro": "",
	"pago": 10,
	"pueblo": "Guaynabo",
	"servicio": "Cajas",
	"telefono": "017875299545",
	"unidades": 1,
	"updatedAt": "2016-02-08T22:20:07.930Z"
}, {
	"activo": true,
	"clave": "",
	"createdAt": "2016-02-08T22:22:42.798Z",
	"deuda": 0,
	"expiracion": "03/08/2016",
	"metodo": "Otro",
	"nombre": "Wilfredo Cruz Rivera / Nuevo",
	"objectId": "9Rn42JmFdF",
	"otro": "",
	"pago": 10,
	"pueblo": "Guaynabo",
	"servicio": "Cajas",
	"telefono": "117875299545",
	"unidades": 1,
	"updatedAt": "2016-02-08T22:22:42.798Z"
}, {
	"activo": true,
	"clave": "",
	"createdAt": "2015-03-21T03:46:02.907Z",
	"deuda": 0,
	"expiracion": "03/09/2016",
	"metodo": "Correo",
	"nombre": "Maritza Izagas / Nuevo",
	"objectId": "CIB51Nxsh0",
	"otro": "",
	"pago": 10,
	"pueblo": "Guaynabo",
	"servicio": "Cajas",
	"telefono": "117876371763",
	"ultimo_pago": "12/6/2015 10:47 AM ($30.00) - Yai Toro",
	"unidades": 1,
	"updatedAt": "2015-12-06T14:47:30.204Z"
}, {
	"activo": true,
	"clave": "",
	"createdAt": "2015-05-17T19:04:48.831Z",
	"deuda": 0,
	"expiracion": "03/09/2016",
	"metodo": "Correo",
	"nombre": "Maritza Izagas / Nuevo",
	"objectId": "oQ1evPQVsi",
	"otro": "",
	"pago": 10,
	"pueblo": "Guaynabo",
	"servicio": "Cajas",
	"telefono": "017876371763",
	"ultimo_pago": "12/6/2015 10:47 AM ($30.00) - Yai Toro",
	"unidades": 1,
	"updatedAt": "2015-12-06T14:47:40.911Z"
}, {
	"activo": true,
	"clave": "",
	"createdAt": "2015-04-04T15:31:59.407Z",
	"deuda": 0,
	"expiracion": "03/09/2016",
	"metodo": "Otro",
	"nombre": "Luis Gonzalez / Javier Valentin",
	"objectId": "IIVECAnPPu",
	"otro": "Paypal atra vez Javier Valentin 8/sept/15 le di un mes de mas el cual no le pertenese att awilda",
	"pago": 15,
	"pueblo": "Bayamon",
	"servicio": "Pix",
	"telefono": "+1 (787) 364-0866",
	"ultimo_pago": "2/4/2016 11:10 PM ($15.00) - Yai Toro",
	"unidades": 1,
	"updatedAt": "2016-02-05T03:11:18.910Z"
}, {
	"activo": true,
	"clave": "",
	"createdAt": "2015-04-04T18:01:13.615Z",
	"deuda": 0,
	"expiracion": "03/09/2016",
	"metodo": "Paypal",
	"nombre": "Jose A Rosario Rodriguez(Padre)",
	"objectId": "KeocHxPrh9",
	"otro": "",
	"pago": 15,
	"pueblo": "Manati",
	"servicio": "Mach Tv",
	"telefono": "+1 (787) 383-8718",
	"ultimo_pago": "2/7/2016 12:46 PM ($15.00) - Yai Toro",
	"unidades": 1,
	"updatedAt": "2016-02-07T16:47:32.436Z"
}, {
	"activo": true,
	"clave": "",
	"createdAt": "2015-10-06T00:47:51.469Z",
	"deuda": 0,
	"expiracion": "03/09/2016",
	"metodo": "Ath Movil",
	"nombre": "Yolanda Jimenez / Yarimar Pagan",
	"objectId": "jiEHYlPxmR",
	"otro": "",
	"pago": 15,
	"pueblo": "Vega Baja",
	"servicio": "Pix",
	"telefono": "+1 (787) 467-2624",
	"ultimo_pago": "2/7/2016 12:40 PM ($15.00) - Yai Toro",
	"unidades": 1,
	"updatedAt": "2016-02-07T16:44:15.559Z"
}, {
	"activo": true,
	"clave": "",
	"createdAt": "2016-01-07T21:37:10.531Z",
	"deuda": 0,
	"expiracion": "03/09/2016",
	"metodo": "Paypal",
	"nombre": "Osvaldo Castro Rivera",
	"objectId": "JrXHcT0nk5",
	"otro": "",
	"pago": 15,
	"pueblo": "Caguas",
	"servicio": "Pix",
	"telefono": "+1 (787) 202-2611",
	"ultimo_pago": "2/7/2016 1:03 PM ($15.00) - Yai Toro",
	"unidades": 1,
	"updatedAt": "2016-02-07T17:04:31.680Z"
}, {
	"activo": true,
	"clave": "",
	"createdAt": "2016-02-09T21:24:53.151Z",
	"deuda": 0,
	"expiracion": "03/09/2016",
	"metodo": "Otro",
	"nombre": "Sara Pacheco Trinidad / Nuevo",
	"objectId": "hkTV02aHom",
	"otro": "",
	"pago": 10,
	"pueblo": "Caimito",
	"servicio": "Cajas",
	"telefono": "017875902824",
	"unidades": 1,
	"updatedAt": "2016-02-09T21:24:53.151Z"
}, {
	"activo": true,
	"clave": "",
	"createdAt": "2015-05-07T17:36:52.414Z",
	"deuda": 0,
	"expiracion": "03/10/2016",
	"metodo": "Personal",
	"nombre": "Bernice Cruz",
	"objectId": "THV4FF26K9",
	"otro": "",
	"pago": 15,
	"pueblo": "BM",
	"servicio": "Internet 2M",
	"telefono": "+1 (787) 692-0910",
	"ultimo_pago": "2/8/2016 10:46 AM ($15.00) - Yai Toro",
	"unidades": 1,
	"updatedAt": "2016-02-08T14:47:11.769Z"
}, {
	"activo": true,
	"clave": "",
	"createdAt": "2015-05-26T02:13:24.727Z",
	"deuda": 0,
	"expiracion": "03/10/2016",
	"metodo": "Personal",
	"nombre": "Bernice Cruz",
	"objectId": "K0wMQFcF8c",
	"otro": "",
	"pago": 10,
	"pueblo": "Bm",
	"servicio": "Pix",
	"telefono": "*1 (787) 692-0910",
	"ultimo_pago": "2/8/2016 10:46 AM ($10.00) - Yai Toro",
	"unidades": 1,
	"updatedAt": "2016-02-08T14:47:22.930Z"
}, {
	"activo": true,
	"clave": "",
	"createdAt": "2015-05-13T23:30:34.845Z",
	"deuda": 0,
	"expiracion": "03/10/2016",
	"metodo": "Otro",
	"nombre": " Jensen Medina / Jensen00",
	"objectId": "UUsiwrHuR6",
	"otro": "No Paga, Intercambio por ventas de rokus en su local por Jensen",
	"pago": 0,
	"pueblo": "Caguas",
	"servicio": "Pix",
	"telefono": "+1 (787) 531-4153",
	"ultimo_pago": "2/10/2016 10:08 AM Acreditado 1 mes - Awilda Hernandez",
	"unidades": 1,
	"updatedAt": "2016-02-10T14:10:57.242Z"
}, {
	"activo": true,
	"clave": "",
	"createdAt": "2016-01-04T13:20:24.558Z",
	"deuda": 0,
	"expiracion": "03/10/2016",
	"metodo": "Paypal",
	"nombre": "Charlys Lara",
	"objectId": "mNz8lCZE1k",
	"otro": "",
	"pago": 15,
	"pueblo": "Bayamon",
	"servicio": "Mach Tv",
	"telefono": "+1 (787) 518-6176",
	"ultimo_pago": "2/8/2016 1:40 PM ($15.00) - Flor Rivera",
	"unidades": 1,
	"updatedAt": "2016-03-03T19:41:02.753Z"
}, {
	"activo": true,
	"clave": "",
	"createdAt": "2016-02-11T19:00:10.711Z",
	"deuda": 0,
	"expiracion": "03/11/2016",
	"metodo": "Ath Movil",
	"nombre": "Elias Hernandez Vega",
	"objectId": "QXjhh463Sc",
	"otro": "",
	"pago": 15,
	"pueblo": "Caguas",
	"servicio": "Pix",
	"telefono": "+1 (787) 568-0732",
	"unidades": 1,
	"updatedAt": "2016-02-11T19:00:10.711Z"
}, {
	"activo": true,
	"clave": "",
	"createdAt": "2016-02-11T19:00:58.134Z",
	"deuda": 0,
	"expiracion": "03/11/2016",
	"metodo": "Ath Movil",
	"nombre": "Elias Hernandez Vega ",
	"objectId": "4uQcNJ1Gsj",
	"otro": "",
	"pago": 10,
	"pueblo": "Caguas",
	"servicio": "Roku",
	"telefono": "*787-568-0732",
	"unidades": 1,
	"updatedAt": "2016-02-11T19:00:58.134Z"
}, {
	"activo": true,
	"clave": "",
	"createdAt": "2016-02-11T20:05:07.880Z",
	"deuda": 0,
	"expiracion": "03/11/2016",
	"metodo": "Ath Movil",
	"nombre": "Jose A Bou Ramos",
	"objectId": "dW4CxBpyRb",
	"otro": "",
	"pago": 15,
	"pueblo": "Caguas",
	"servicio": "Pix",
	"telefono": "+1 (787) 942-2135",
	"unidades": 1,
	"updatedAt": "2016-02-11T20:05:07.880Z"
}, {
	"activo": true,
	"clave": "",
	"createdAt": "2016-02-11T20:05:58.842Z",
	"deuda": 0,
	"expiracion": "03/11/2016",
	"metodo": "Ath Movil",
	"nombre": "Jose A Bou Ramos ",
	"objectId": "CcFcrgdB8B",
	"otro": "",
	"pago": 10,
	"pueblo": "Caguas ",
	"servicio": "Mach Tv",
	"telefono": "*787-942-2135",
	"unidades": 1,
	"updatedAt": "2016-02-11T20:05:58.842Z"
}, {
	"activo": true,
	"clave": "",
	"createdAt": "2016-02-11T20:26:12.354Z",
	"deuda": 0,
	"expiracion": "03/11/2016",
	"metodo": "Ath Movil",
	"nombre": "Omar Morales",
	"objectId": "J4VpJAXdzr",
	"otro": "",
	"pago": 10,
	"pueblo": "Bayamon",
	"servicio": "Mach Tv",
	"telefono": "*7875850018",
	"unidades": 1,
	"updatedAt": "2016-02-11T20:26:12.354Z"
}, {
	"activo": true,
	"clave": "",
	"createdAt": "2016-02-11T23:16:20.455Z",
	"deuda": 0,
	"expiracion": "03/11/2016",
	"metodo": "Paypal",
	"nombre": "Benjamin Maisonet",
	"objectId": "ALTZY4B21S",
	"otro": "",
	"pago": 15,
	"pueblo": "San Juan",
	"servicio": "Mach Tv",
	"telefono": "*7873971477",
	"unidades": 1,
	"updatedAt": "2016-02-11T23:16:20.455Z"
}, {
	"activo": true,
	"clave": "",
	"createdAt": "2016-02-12T16:47:00.625Z",
	"deuda": 0,
	"expiracion": "03/11/2016",
	"metodo": "Otro",
	"nombre": "Jose Hernandez (Cheo)",
	"objectId": "QvCGcxQ8hj",
	"otro": "02/12/16 Abono $60 debe $40",
	"pago": 10,
	"pueblo": "BM",
	"servicio": "Internet 1M",
	"telefono": "+1 (787) 327-3537",
	"unidades": 1,
	"updatedAt": "2016-02-12T16:47:00.625Z"
}, {
	"activo": true,
	"clave": "",
	"createdAt": "2016-02-13T00:57:53.743Z",
	"deuda": 0,
	"expiracion": "03/12/2016",
	"metodo": "Ath Movil",
	"nombre": "Yessica Hernandez / Jessica",
	"objectId": "3v7SSvAGwb",
	"otro": "",
	"pago": 15,
	"pueblo": "Toa Alta",
	"servicio": "Pix",
	"telefono": "+1 (787) 461-1113",
	"unidades": 1,
	"updatedAt": "2016-02-13T00:57:53.743Z"
}, {
	"activo": true,
	"clave": "",
	"createdAt": "2016-02-13T00:58:22.874Z",
	"deuda": 0,
	"expiracion": "03/12/2016",
	"metodo": "Ath Movil",
	"nombre": "Yessica Hernandez / Jessica",
	"objectId": "iOQg1SNMa6",
	"otro": "",
	"pago": 10,
	"pueblo": "Toa Alta",
	"servicio": "Mach Tv",
	"telefono": "*7874611113",
	"unidades": 1,
	"updatedAt": "2016-02-13T00:58:22.874Z"
}, {
	"activo": true,
	"clave": "",
	"createdAt": "2015-05-24T22:51:01.984Z",
	"deuda": 0,
	"expiracion": "03/13/2016",
	"metodo": "Personal",
	"nombre": "Leandro / Nuevo",
	"objectId": "0oi7lRKCy8",
	"otro": "",
	"pago": 10,
	"pueblo": "Guaynabo",
	"servicio": "Cajas",
	"telefono": "117872453419",
	"unidades": 1,
	"updatedAt": "2015-05-24T22:51:26.612Z"
}, {
	"activo": true,
	"clave": "",
	"createdAt": "2015-06-09T18:18:22.390Z",
	"deuda": 0,
	"expiracion": "03/13/2016",
	"metodo": "Paypal",
	"nombre": "Iris N Guzman Reyes",
	"objectId": "1OLOmfMAYD",
	"otro": "",
	"pago": 15,
	"pueblo": "Florida USA",
	"servicio": "Pix",
	"telefono": "1-321-557-5480 ",
	"ultimo_pago": "2/7/2016 12:09 PM ($15.00) - Yai Toro",
	"unidades": 1,
	"updatedAt": "2016-02-07T16:14:49.456Z"
}, {
	"activo": true,
	"clave": "",
	"createdAt": "2015-03-20T19:51:38.517Z",
	"deuda": 0,
	"expiracion": "03/14/2016",
	"metodo": "Ath Movil",
	"nombre": "Hernan Sanchez / Jenny Vega / Nuevo",
	"objectId": "0VY1NwI6ov",
	"otro": "",
	"pago": 10,
	"pueblo": "Borinquen Valley, Caguas",
	"servicio": "Cajas",
	"telefono": "017879559258 / 787-423-7510",
	"ultimo_pago": "2/5/2016 6:46 PM ($10.00) - Awilda Hernandez",
	"unidades": 1,
	"updatedAt": "2016-02-05T22:48:19.299Z"
}, {
	"activo": true,
	"clave": "",
	"createdAt": "2015-03-22T20:58:58.987Z",
	"deuda": 0,
	"expiracion": "03/14/2016",
	"metodo": "Otro",
	"nombre": "Pablo / Hima / Nuevo",
	"objectId": "AaQ7vhPePv",
	"otro": "No Paga",
	"pago": 0,
	"pueblo": "Turabo Gardens, Gurabo",
	"servicio": "Cajas",
	"telefono": "017879100988",
	"unidades": 1,
	"updatedAt": "2015-12-14T05:01:33.218Z"
}, {
	"activo": true,
	"clave": "",
	"createdAt": "2015-05-17T20:12:06.073Z",
	"deuda": 0,
	"expiracion": "03/14/2016",
	"metodo": "Ath Movil",
	"nombre": "Hernan Sanchez / Jenny Vega / Nuevo",
	"objectId": "UQLrVunDHG",
	"otro": "",
	"pago": 10,
	"pueblo": "Borinken Valley, Caguas",
	"servicio": "Cajas",
	"telefono": "117879559258 / 787-423-7510",
	"ultimo_pago": "2/5/2016 6:46 PM ($10.00) - Awilda Hernandez",
	"unidades": 1,
	"updatedAt": "2016-02-05T22:48:34.545Z"
}, {
	"activo": true,
	"clave": "",
	"createdAt": "2015-08-10T21:48:16.005Z",
	"deuda": 0,
	"expiracion": "03/14/2016",
	"metodo": "Paypal",
	"nombre": "Iris N Guzman Reyez",
	"objectId": "v6VRLX5UlP",
	"otro": "",
	"pago": 10,
	"pueblo": "Florida USA",
	"servicio": "Mach Tv",
	"telefono": "**1-321-557-5480",
	"ultimo_pago": "2/7/2016 12:10 PM ($10.00) - Yai Toro",
	"unidades": 1,
	"updatedAt": "2016-02-07T16:15:05.676Z"
}, {
	"activo": true,
	"clave": "",
	"createdAt": "2016-02-15T14:35:50.120Z",
	"deuda": 0,
	"expiracion": "03/15/2016",
	"metodo": "Ath Movil",
	"nombre": "Luis Santana",
	"objectId": "XjNOaQwyhD",
	"otro": "",
	"pago": 15,
	"pueblo": "Juncos",
	"servicio": "Mach Tv",
	"telefono": "*7879401289",
	"unidades": 1,
	"updatedAt": "2016-02-15T14:35:50.120Z"
}, {
	"activo": true,
	"clave": "",
	"createdAt": "2016-02-15T20:45:22.918Z",
	"deuda": 0,
	"expiracion": "03/15/2016",
	"metodo": "Ath Movil",
	"nombre": "Julio Leon Marrero",
	"objectId": "Uwzp01aK8E",
	"otro": "",
	"pago": 15,
	"pueblo": "Cayey",
	"servicio": "Mach Tv",
	"telefono": "787-361-7746 / 787-535-1384",
	"unidades": 1,
	"updatedAt": "2016-02-15T20:45:22.918Z"
}, {
	"activo": true,
	"clave": "",
	"createdAt": "2016-02-15T22:28:18.791Z",
	"deuda": 0,
	"expiracion": "03/15/2016",
	"metodo": "Otro",
	"nombre": "Eugenio Martinez Montañez / Nuevo",
	"objectId": "EwAU8egdTQ",
	"otro": "",
	"pago": 10,
	"pueblo": "San Lorenzo",
	"servicio": "Cajas",
	"telefono": "017877367352",
	"unidades": 1,
	"updatedAt": "2016-02-15T22:28:18.791Z"
}, {
	"activo": true,
	"clave": "",
	"createdAt": "2015-03-18T19:07:04.495Z",
	"deuda": 0,
	"expiracion": "03/16/2016",
	"metodo": "Paypal",
	"nombre": "Emilio Rios/ Nuevo",
	"objectId": "X1wGnREUjs",
	"otro": "",
	"pago": 10,
	"pueblo": "Villa Keneddy, Santurce",
	"servicio": "Cajas",
	"telefono": "217877287889 / 787-906-6506",
	"ultimo_pago": "2/16/2016 12:22 PM ($10.00) - Flor Rivera",
	"unidades": 1,
	"updatedAt": "2016-02-16T16:23:54.667Z"
}, {
	"activo": true,
	"clave": "",
	"createdAt": "2015-06-11T18:33:41.729Z",
	"deuda": 0,
	"expiracion": "03/16/2016",
	"metodo": "Ath Movil",
	"nombre": " Dennis Anel Pagan / Nuevo",
	"objectId": "yl8a4JSVdp",
	"otro": "",
	"pago": 10,
	"pueblo": "Borinquen,Caguas",
	"servicio": "Cajas",
	"telefono": "017873104425",
	"ultimo_pago": "2/14/2016 7:33 PM ($10.00) - Yai Toro",
	"unidades": 1,
	"updatedAt": "2016-02-14T23:34:26.813Z"
}, {
	"activo": true,
	"clave": "",
	"createdAt": "2015-10-27T00:52:06.003Z",
	"deuda": 0,
	"expiracion": "03/16/2016",
	"metodo": "Ath Movil",
	"nombre": "Luis Rosario Marrero",
	"objectId": "nHGCDWJ8Hz",
	"otro": "",
	"pago": 10,
	"pueblo": "Cidra",
	"servicio": "Pix",
	"telefono": "*787-944-5635",
	"ultimo_pago": "2/14/2016 7:36 PM ($10.00) - Yai Toro",
	"unidades": 1,
	"updatedAt": "2016-02-14T23:38:17.824Z"
}, {
	"activo": true,
	"clave": "",
	"createdAt": "2015-12-11T16:41:40.419Z",
	"deuda": 0,
	"expiracion": "03/16/2016",
	"metodo": "Ath Movil",
	"nombre": "Jose Delgado Flores",
	"objectId": "TPxxk943Ik",
	"otro": "",
	"pago": 15,
	"pueblo": "Caguas",
	"servicio": "Pix",
	"telefono": "+1 (787) 459-2975",
	"ultimo_pago": "2/14/2016 7:39 PM ($15.00) - Yai Toro",
	"unidades": 1,
	"updatedAt": "2016-02-14T23:40:33.482Z"
}, {
	"activo": true,
	"clave": "",
	"createdAt": "2015-12-14T23:11:36.161Z",
	"deuda": 0,
	"expiracion": "03/16/2016",
	"metodo": "Ath Movil",
	"nombre": "Freddie Rivera",
	"objectId": "LMhbXV8lwu",
	"otro": "",
	"pago": 15,
	"pueblo": "Las Piedras",
	"servicio": "Mach Tv",
	"telefono": "+1 (787) 517-7537",
	"ultimo_pago": "2/13/2016 6:52 PM ($15.00) - Yai Toro",
	"unidades": 1,
	"updatedAt": "2016-02-13T22:53:06.729Z"
}, {
	"activo": true,
	"clave": "",
	"createdAt": "2016-01-14T19:58:31.382Z",
	"deuda": 0,
	"expiracion": "03/16/2016",
	"metodo": "Paypal",
	"nombre": "Melvin Rivera",
	"objectId": "3AWIonozZz",
	"otro": "",
	"pago": 15,
	"pueblo": "Carolina",
	"servicio": "Pix",
	"telefono": "+1 (787) 923-2125",
	"ultimo_pago": "2/14/2016 7:28 PM ($15.00) - Yai Toro",
	"unidades": 1,
	"updatedAt": "2016-02-14T23:29:19.107Z"
}, {
	"activo": true,
	"clave": "",
	"createdAt": "2016-02-16T22:14:14.552Z",
	"deuda": 0,
	"expiracion": "03/16/2016",
	"metodo": "Ath Movil",
	"nombre": "Luis Nieves / Karla Algarin / 2do Roku ",
	"objectId": "U5GQZvPb86",
	"otro": "",
	"pago": 15,
	"pueblo": "Carolina",
	"servicio": "Mach Tv",
	"telefono": "**787-585-0056",
	"unidades": 1,
	"updatedAt": "2016-02-16T22:14:14.552Z"
}, {
	"activo": true,
	"clave": "",
	"createdAt": "2016-02-16T23:29:52.586Z",
	"deuda": 0,
	"expiracion": "03/16/2016",
	"metodo": "Otro",
	"nombre": "Sheila Diaz Flores /Nuevo",
	"objectId": "zXN5ANlcYh",
	"otro": "",
	"pago": 10,
	"pueblo": "San Lorenzo",
	"servicio": "Cajas",
	"telefono": "019396405022",
	"unidades": 1,
	"updatedAt": "2016-02-16T23:29:52.586Z"
}, {
	"activo": true,
	"clave": "",
	"createdAt": "2016-02-17T00:05:15.292Z",
	"deuda": 0,
	"expiracion": "03/16/2016",
	"metodo": "Ath Movil",
	"nombre": "Ramon Hernandez La Santa / Angelica Hernandez",
	"objectId": "Cv3vJF1oVe",
	"otro": "",
	"pago": 15,
	"pueblo": "Bayamon",
	"servicio": "Pix",
	"telefono": "+1 (787) 579-4289",
	"unidades": 1,
	"updatedAt": "2016-02-17T00:05:15.292Z"
}, {
	"activo": true,
	"clave": "",
	"createdAt": "2015-04-10T22:53:36.084Z",
	"deuda": 0,
	"expiracion": "03/17/2016",
	"metodo": "Paypal",
	"nombre": "Edwin Rivera / Carmen Santa",
	"objectId": "om4dJrboIo",
	"otro": "",
	"pago": 15,
	"pueblo": "Ponce",
	"servicio": "Pix",
	"telefono": "+1 (787) 298-1629",
	"ultimo_pago": "2/14/2016 12:04 AM ($15.00) - Yai Toro",
	"unidades": 1,
	"updatedAt": "2016-02-14T04:05:51.024Z"
}, {
	"activo": true,
	"clave": "",
	"createdAt": "2015-07-31T00:41:51.378Z",
	"deuda": 0,
	"expiracion": "03/17/2016",
	"metodo": "Otro",
	"nombre": "Delta Fernandez / Nuevo",
	"objectId": "Ua1xqrwCsA",
	"otro": "No Paga",
	"pago": 0,
	"pueblo": "Estacion Loma El 5 ",
	"servicio": "Cajas",
	"telefono": "017875032744",
	"unidades": 1,
	"updatedAt": "2015-10-04T15:43:36.497Z"
}, {
	"activo": true,
	"clave": "",
	"createdAt": "2015-07-31T00:42:49.956Z",
	"deuda": 0,
	"expiracion": "03/17/2016",
	"metodo": "Otro",
	"nombre": "Delta Fernandez / Nuevo",
	"objectId": "huVUMFmFPA",
	"otro": "No Paga",
	"pago": 0,
	"pueblo": "Estacion Loma El 5",
	"servicio": "Cajas",
	"telefono": "117875032744",
	"unidades": 1,
	"updatedAt": "2015-10-04T15:43:52.054Z"
}, {
	"activo": true,
	"clave": "",
	"createdAt": "2016-02-17T14:42:28.711Z",
	"deuda": 0,
	"expiracion": "03/17/2016",
	"metodo": "Otro",
	"nombre": "Angel G Flores Aponte",
	"objectId": "fStBRTDg4m",
	"otro": "",
	"pago": 10,
	"pueblo": "Aguas Buenas",
	"servicio": "Cajas",
	"telefono": "017879054442",
	"unidades": 1,
	"updatedAt": "2016-02-17T14:42:28.711Z"
}, {
	"activo": true,
	"clave": "",
	"createdAt": "2015-08-05T14:59:53.913Z",
	"deuda": 0,
	"expiracion": "03/18/2016",
	"metodo": "Otro",
	"nombre": "Juan Aguayo Rodriguez / Nuevo",
	"objectId": "okznjxdEtu",
	"otro": "02/11/16 se le dio crédito por Jose A Aguallo",
	"pago": 10,
	"pueblo": "Gurabo",
	"servicio": "Cajas",
	"telefono": "017873488082",
	"ultimo_pago": "2/11/2016 11:01 AM Acreditado 1 mes - Awilda Hernandez",
	"unidades": 1,
	"updatedAt": "2016-02-18T17:26:28.100Z"
}, {
	"activo": true,
	"clave": "",
	"createdAt": "2016-02-18T13:36:02.765Z",
	"deuda": 0,
	"expiracion": "03/18/2016",
	"metodo": "Paypal",
	"nombre": "Carlos Bonilla",
	"objectId": "UC5SMwjGeb",
	"otro": "",
	"pago": 15,
	"pueblo": "Cayey",
	"servicio": "Mach Tv",
	"telefono": "*7879756277",
	"unidades": 1,
	"updatedAt": "2016-02-18T13:36:02.765Z"
}, {
	"activo": true,
	"clave": "",
	"createdAt": "2016-02-18T23:49:47.536Z",
	"deuda": 0,
	"expiracion": "03/18/2016",
	"metodo": "Paypal",
	"nombre": "Richard Collazo (Richi) PRIMO 2do Roku",
	"objectId": "7iTp1ZgIRE",
	"otro": "",
	"pago": 15,
	"pueblo": "Juncos",
	"servicio": "Mach Tv",
	"telefono": "+1 (863) 337-6375",
	"unidades": 1,
	"updatedAt": "2016-02-18T23:49:47.536Z"
}, {
	"activo": true,
	"clave": "",
	"createdAt": "2016-02-19T00:26:05.353Z",
	"deuda": 0,
	"expiracion": "03/18/2016",
	"metodo": "Ath Movil",
	"nombre": "Julio Medina Diaz  / Julio00",
	"objectId": "avthsjiOxt",
	"otro": "",
	"pago": 15,
	"pueblo": "Caguas",
	"servicio": "Pix",
	"telefono": "*787-531-4153",
	"unidades": 1,
	"updatedAt": "2016-02-19T00:26:05.353Z"
}, {
	"activo": true,
	"clave": "",
	"createdAt": "2015-03-18T22:53:05.501Z",
	"deuda": 0,
	"expiracion": "03/19/2016",
	"metodo": "Personal",
	"nombre": "Samuel Rosa (Sammy) / Nuevo",
	"objectId": "14vMpucYly",
	"otro": "",
	"pago": 10,
	"pueblo": "Villas De Castro, Caguas",
	"servicio": "Cajas",
	"telefono": "017874106174",
	"unidades": 1,
	"updatedAt": "2016-01-19T16:45:35.307Z"
}, {
	"activo": true,
	"clave": "",
	"createdAt": "2015-05-17T21:28:10.536Z",
	"deuda": 0,
	"expiracion": "03/19/2016",
	"metodo": "Personal",
	"nombre": "Samuel Rosa (Sammy) / Nuevo",
	"objectId": "Eg4u5368K5",
	"otro": "",
	"pago": 10,
	"pueblo": "Villas De Castro, Caguas",
	"servicio": "Cajas",
	"telefono": "117874106174",
	"unidades": 1,
	"updatedAt": "2016-01-19T16:45:46.616Z"
}, {
	"activo": true,
	"clave": "",
	"createdAt": "2015-03-22T20:47:26.580Z",
	"deuda": 0,
	"expiracion": "03/19/2016",
	"metodo": "Personal",
	"nombre": "Feliciano Davila / Nuevo",
	"objectId": "6amrELNcHr",
	"otro": "",
	"pago": 10,
	"pueblo": "Villa Rey 4ta, Caguas",
	"servicio": "Cajas",
	"telefono": "019396408597",
	"ultimo_pago": "8/11/2015 3:07 PM ($60.00) - Awilda Hernandez",
	"unidades": 1,
	"updatedAt": "2016-01-19T13:13:26.536Z"
}, {
	"activo": true,
	"clave": "",
	"createdAt": "2016-02-19T16:21:42.646Z",
	"deuda": 0,
	"expiracion": "03/19/2016",
	"metodo": "Ath Movil",
	"nombre": "Alfredo Ramos 00 / Omayra Rivera",
	"objectId": "jeNWzRs35g",
	"otro": "",
	"pago": 15,
	"pueblo": "La Piedras",
	"servicio": "Pix",
	"telefono": "**7874759139",
	"unidades": 1,
	"updatedAt": "2016-02-19T16:21:42.646Z"
}, {
	"activo": true,
	"clave": "",
	"createdAt": "2015-03-18T22:36:26.562Z",
	"deuda": 0,
	"expiracion": "03/20/2016",
	"metodo": "Ath Movil",
	"nombre": "Jonathan Adorno / Dariana Hernandez / Nuevo",
	"objectId": "m3QpHJkCKP",
	"otro": "",
	"pago": 10,
	"pueblo": "Rio PIedras",
	"servicio": "Cajas",
	"telefono": "017876197946",
	"ultimo_pago": "6/30/2015 7:53 PM ($10.00) - Flor Rivera",
	"unidades": 1,
	"updatedAt": "2015-12-20T16:33:30.207Z"
}, {
	"activo": true,
	"clave": "",
	"createdAt": "2015-06-16T16:42:45.686Z",
	"deuda": 0,
	"expiracion": "03/20/2016",
	"metodo": "Paypal",
	"nombre": "Ismael Cepeda Tabales",
	"objectId": "AcD6nj9f5b",
	"otro": "",
	"pago": 15,
	"pueblo": "Juncos",
	"servicio": "Mach Tv",
	"telefono": "+1 (787) 914-9162",
	"ultimo_pago": "2/13/2016 6:46 PM ($15.00) - Yai Toro",
	"unidades": 1,
	"updatedAt": "2016-02-13T22:47:36.608Z"
}, {
	"activo": true,
	"clave": "",
	"createdAt": "2015-04-17T22:09:20.767Z",
	"deuda": 0,
	"expiracion": "03/20/2016",
	"metodo": "Otro",
	"nombre": "Gregorio Fernandez / Nuevo",
	"objectId": "1ul0jMA9ca",
	"otro": "No paga mensualidad sobrino de Delta Estacion Loma del 5",
	"pago": 0,
	"pueblo": "Caguas a San Lorenzo",
	"servicio": "Cajas",
	"telefono": "017879552289",
	"ultimo_pago": "8/18/2015 10:11 AM ($0.00) - Flor Rivera",
	"unidades": 1,
	"updatedAt": "2015-10-21T03:19:33.407Z"
}, {
	"activo": true,
	"clave": "",
	"createdAt": "2015-11-16T21:56:16.554Z",
	"deuda": 0,
	"expiracion": "03/20/2016",
	"metodo": "Paypal",
	"nombre": "Omar Ramos / Emilio Rios / Ismaly Huertas",
	"objectId": "DKlB8mpglp",
	"otro": "",
	"pago": 10,
	"pueblo": "Vega Alta 3 monjita",
	"servicio": "Mach Tv",
	"telefono": "+1 (787) 367-6798",
	"ultimo_pago": "2/18/2016 4:39 PM ($10.00) - Flor Rivera",
	"unidades": 1,
	"updatedAt": "2016-02-22T19:05:40.882Z"
}, {
	"activo": true,
	"clave": "",
	"createdAt": "2015-03-20T20:52:52.197Z",
	"deuda": 0,
	"expiracion": "03/21/2016",
	"metodo": "Personal",
	"nombre": "Hector Del Valle Ribot / Angel Del Valle / Nuevo",
	"objectId": "htmFFfhHLl",
	"otro": "",
	"pago": 10,
	"pueblo": "Urb, Delgado, Caguas",
	"servicio": "Cajas",
	"telefono": "017875791776 / 939-219-3653",
	"ultimo_pago": "2/18/2016 11:37 PM ($20.00) - Awilda Hernandez",
	"unidades": 1,
	"updatedAt": "2016-02-19T03:38:57.861Z"
}, {
	"activo": true,
	"clave": "",
	"createdAt": "2015-07-11T00:51:06.419Z",
	"deuda": 0,
	"expiracion": "03/21/2016",
	"metodo": "Ath Movil",
	"nombre": "Dennis Alvarado 00 /  Erika Oneill",
	"objectId": "8pChoBjYKd",
	"otro": "",
	"pago": 10,
	"pueblo": "Aguas Buenas, Sonadora",
	"servicio": "Pix",
	"telefono": "-1-787-205-5590",
	"ultimo_pago": "2/19/2016 5:14 PM ($10.00) - Awilda Hernandez",
	"unidades": 1,
	"updatedAt": "2016-02-19T21:15:06.953Z"
}, {
	"activo": true,
	"clave": "",
	"createdAt": "2015-03-18T23:22:19.322Z",
	"deuda": 0,
	"expiracion": "03/22/2016",
	"metodo": "Personal",
	"nombre": "Raquel Castro  / Nuevo",
	"objectId": "jsL1Nsgu8R",
	"otro": "",
	"pago": 10,
	"pueblo": "Gurabo",
	"servicio": "Cajas",
	"telefono": "017875987238 ó 787-631-8580",
	"ultimo_pago": "2/18/2016 10:28 AM ($10.00) - Flor Rivera",
	"unidades": 1,
	"updatedAt": "2016-02-22T20:40:22.638Z"
}, {
	"activo": true,
	"clave": "",
	"createdAt": "2015-05-17T21:04:38.400Z",
	"deuda": 0,
	"expiracion": "03/22/2016",
	"metodo": "Paypal",
	"nombre": "Jose M Burgos / Nuevo",
	"objectId": "E4dcznaUGe",
	"otro": "",
	"pago": 10,
	"pueblo": "Bayamon",
	"servicio": "Cajas",
	"telefono": "017873765508",
	"ultimo_pago": "2/15/2016 11:55 AM ($10.00) - Flor Rivera",
	"unidades": 1,
	"updatedAt": "2016-02-22T13:40:21.542Z"
}, {
	"activo": true,
	"clave": "",
	"createdAt": "2015-05-26T02:07:01.336Z",
	"deuda": 0,
	"expiracion": "03/22/2016",
	"metodo": "Personal",
	"nombre": "Angel Jimenez / Marcelina Rodriguez",
	"objectId": "O3RqsLAH2V",
	"otro": "",
	"pago": 10,
	"pueblo": "Borinquen / Caguas",
	"servicio": "Pix",
	"telefono": "*1 (787) 596-0738",
	"ultimo_pago": "2/19/2016 6:30 PM ($10.00) - Awilda Hernandez",
	"unidades": 1,
	"updatedAt": "2016-02-20T20:26:07.932Z"
}, {
	"activo": true,
	"clave": "",
	"createdAt": "2015-08-11T02:14:28.550Z",
	"deuda": 0,
	"expiracion": "03/22/2016",
	"metodo": "Otro",
	"nombre": "Luis Flores Fontanez / Luisflores00 1er Roku/ 4E652D086155",
	"objectId": "WgcjkJjl2x",
	"otro": "",
	"pago": 15,
	"pueblo": "Caguas",
	"servicio": "Pix",
	"telefono": "*787-472-9586",
	"ultimo_pago": "2/19/2016 5:56 PM ($15.00) - Awilda Hernandez",
	"unidades": 1,
	"updatedAt": "2016-02-20T20:23:29.304Z"
}, {
	"activo": true,
	"clave": "",
	"createdAt": "2015-10-09T15:26:12.935Z",
	"deuda": 0,
	"expiracion": "03/22/2016",
	"metodo": "Paypal",
	"nombre": "Jose R De Jesus Alvarez / Aixa Hernandez Cruz//jesus/aixahernandez00",
	"objectId": "3Mw8Qk0JCA",
	"otro": "",
	"pago": 10,
	"pueblo": "Yabucoa",
	"servicio": "Pix",
	"telefono": "787-439-8038 ó 787469-1033",
	"ultimo_pago": "2/7/2016 1:05 PM ($10.00) - Yai Toro",
	"unidades": 1,
	"updatedAt": "2016-02-07T17:06:39.917Z"
}, {
	"activo": true,
	"clave": "",
	"createdAt": "2015-10-18T02:27:54.351Z",
	"deuda": 0,
	"expiracion": "03/22/2016",
	"metodo": "Paypal",
	"nombre": "Laureano Gonzalez / 1er roku Muriel 00",
	"objectId": "uuWdBcHreq",
	"otro": "",
	"pago": 10,
	"pueblo": "Carolina",
	"servicio": "Mach Tv",
	"telefono": "-787-598-8989",
	"ultimo_pago": "2/20/2016 4:08 PM ($10.00) - Yai Toro",
	"unidades": 1,
	"updatedAt": "2016-02-20T20:08:34.690Z"
}, {
	"activo": true,
	"clave": "",
	"createdAt": "2015-10-21T12:38:11.047Z",
	"deuda": 0,
	"expiracion": "03/22/2016",
	"metodo": "Personal",
	"nombre": "Hector Merced / Suncho",
	"objectId": "RZdQSLlHeY",
	"otro": "",
	"pago": 10,
	"pueblo": "Cidra",
	"servicio": "Pix",
	"telefono": "+1 (787) 595-7466",
	"ultimo_pago": "2/16/2016 7:01 AM ($10.00) - Yai Toro",
	"unidades": 1,
	"updatedAt": "2016-02-16T11:03:28.905Z"
}, {
	"activo": true,
	"clave": "",
	"createdAt": "2015-12-02T14:30:42.494Z",
	"deuda": 0,
	"expiracion": "03/22/2016",
	"metodo": "Ath Movil",
	"nombre": "Maribel Torres",
	"objectId": "Qq6X07wtUT",
	"otro": "",
	"pago": 15,
	"pueblo": "Toa Alta",
	"servicio": "Pix",
	"telefono": "+1 (787) 565-7189",
	"ultimo_pago": "2/19/2016 6:29 PM ($15.00) - Awilda Hernandez",
	"unidades": 1,
	"updatedAt": "2016-02-20T20:25:22.954Z"
}, {
	"activo": true,
	"clave": "",
	"createdAt": "2015-12-18T17:37:34.739Z",
	"deuda": 0,
	"expiracion": "03/22/2016",
	"metodo": "Ath Movil",
	"nombre": "Luis Flores Fontanez / Luisflore01 / 2do Roku YY00DV876381",
	"objectId": "83vMz0GLrs",
	"otro": "",
	"pago": 15,
	"pueblo": "Caguas",
	"servicio": "Pix",
	"telefono": "*7874729586",
	"ultimo_pago": "2/19/2016 5:55 PM ($15.00) - Awilda Hernandez",
	"unidades": 1,
	"updatedAt": "2016-02-20T20:23:40.157Z"
}, {
	"activo": true,
	"clave": "",
	"createdAt": "2016-01-21T01:54:18.719Z",
	"deuda": 0,
	"expiracion": "03/22/2016",
	"metodo": "Ath Movil",
	"nombre": "Gerardo Gonzalez Rosa / Alex Gonzalez / YY003A277555",
	"objectId": "8JXHh6j3tX",
	"otro": "",
	"pago": 15,
	"pueblo": "San Lorenzo",
	"servicio": "Pix",
	"telefono": "+1 (787) 342-8276",
	"ultimo_pago": "2/19/2016 8:58 PM ($15.00) - Awilda Hernandez",
	"unidades": 1,
	"updatedAt": "2016-02-20T20:28:00.365Z"
}, {
	"activo": true,
	"clave": "",
	"createdAt": "2016-02-22T15:08:33.052Z",
	"deuda": 0,
	"expiracion": "03/22/2016",
	"metodo": "Otro",
	"nombre": "Euder Rodriguez Nieves / Nuevo",
	"objectId": "aN34dpCdlR",
	"otro": "",
	"pago": 10,
	"pueblo": "Bayamon",
	"servicio": "Cajas",
	"telefono": "017872182444",
	"unidades": 1,
	"updatedAt": "2016-02-22T15:08:33.052Z"
}, {
	"activo": true,
	"clave": "",
	"createdAt": "2015-03-19T22:29:49.363Z",
	"deuda": 0,
	"expiracion": "03/23/2016",
	"metodo": "Personal",
	"nombre": "Wanda Balvidia / Georgie Arieta / Nuevo",
	"objectId": "NzjsBkKE3k",
	"otro": "",
	"pago": 10,
	"pueblo": "Bairoa La 25, Caguas",
	"servicio": "Cajas",
	"telefono": "017876319990",
	"ultimo_pago": "11/30/2015 7:41 PM ($10.00) - Flor Rivera",
	"unidades": 1,
	"updatedAt": "2016-02-23T22:03:58.256Z"
}, {
	"activo": true,
	"clave": "",
	"createdAt": "2015-03-18T02:57:05.611Z",
	"deuda": 0,
	"expiracion": "03/23/2016",
	"metodo": "Personal",
	"nombre": "Victor Torres / Nuevo",
	"objectId": "nmmQwBSG2Z",
	"otro": "",
	"pago": 10,
	"pueblo": "Las Corujas, Aguas Buenas",
	"servicio": "Cajas",
	"telefono": "017876305374",
	"ultimo_pago": "2/20/2016 12:33 PM ($10.00) - Yai Toro",
	"unidades": 1,
	"updatedAt": "2016-02-20T16:33:01.453Z"
}, {
	"activo": true,
	"clave": "",
	"createdAt": "2015-11-19T20:51:42.791Z",
	"deuda": 0,
	"expiracion": "03/23/2016",
	"metodo": "Ath Movil",
	"nombre": "Letisia Arroyo Delgado / Juan Pedraza",
	"objectId": "6ck5LGuQBN",
	"otro": "",
	"pago": 10,
	"pueblo": "Las Piedras ",
	"servicio": "Mach Tv",
	"telefono": "**787-394-2194",
	"ultimo_pago": "2/20/2016 3:58 PM ($10.00) - Yai Toro",
	"unidades": 1,
	"updatedAt": "2016-02-20T20:00:47.735Z"
}, {
	"activo": true,
	"clave": "",
	"createdAt": "2015-11-21T18:00:54.627Z",
	"deuda": 0,
	"expiracion": "03/24/2016",
	"metodo": "Paypal",
	"nombre": "Javier Valentin",
	"objectId": "z4dpz8U0yp",
	"otro": "",
	"pago": 10,
	"pueblo": "Bayamon Rooms to Go",
	"servicio": "Pix",
	"telefono": "**787-688-6905",
	"ultimo_pago": "2/19/2016 8:36 PM ($10.00) - Awilda Hernandez",
	"unidades": 1,
	"updatedAt": "2016-02-20T20:27:04.754Z"
}, {
	"activo": true,
	"clave": "",
	"createdAt": "2016-02-24T13:39:15.097Z",
	"deuda": 0,
	"expiracion": "03/24/2016",
	"metodo": "Otro",
	"nombre": "Yaritza Hernandez Montañez / Nuevo",
	"objectId": "H75Wqeyjk8",
	"otro": "",
	"pago": 10,
	"pueblo": "Aguas Buenas",
	"servicio": "Cajas",
	"telefono": "017875903281 / 787-436-7941",
	"unidades": 1,
	"updatedAt": "2016-02-24T13:39:15.097Z"
}, {
	"activo": true,
	"clave": "",
	"createdAt": "2016-02-25T17:49:50.796Z",
	"deuda": 0,
	"expiracion": "03/25/2016",
	"metodo": "Otro",
	"nombre": "Andres Delgado Flores ",
	"objectId": "nPtPGtsGvz",
	"otro": "",
	"pago": 15,
	"pueblo": "Caguas",
	"servicio": "Pix",
	"telefono": "+1 (787) 207-5653",
	"unidades": 1,
	"updatedAt": "2016-02-25T17:49:50.796Z"
}, {
	"activo": true,
	"clave": "",
	"createdAt": "2016-02-25T17:50:46.896Z",
	"deuda": 0,
	"expiracion": "03/25/2016",
	"metodo": "Otro",
	"nombre": "Andres Dlegado Flores ",
	"objectId": "hgLmYyxYlk",
	"otro": "",
	"pago": 10,
	"pueblo": "Caguas",
	"servicio": "Mach Tv",
	"telefono": "*787-207-5653",
	"unidades": 1,
	"updatedAt": "2016-02-25T17:50:46.896Z"
}, {
	"activo": true,
	"clave": "",
	"createdAt": "2016-02-25T17:52:28.296Z",
	"deuda": 0,
	"expiracion": "03/25/2016",
	"metodo": "Otro",
	"nombre": "Andres Delgado Flores ",
	"objectId": "uMA4tfjBwx",
	"otro": "",
	"pago": 10,
	"pueblo": "Caguas",
	"servicio": "Mach Tv",
	"telefono": "**787-207-5653",
	"unidades": 1,
	"updatedAt": "2016-02-25T17:52:28.296Z"
}, {
	"activo": true,
	"clave": "",
	"createdAt": "2016-02-25T17:53:32.592Z",
	"deuda": 0,
	"expiracion": "03/25/2016",
	"metodo": "Otro",
	"nombre": "Andres Delgado Flores",
	"objectId": "6tElCbR745",
	"otro": "",
	"pago": 10,
	"pueblo": "Caguas ",
	"servicio": "Roku",
	"telefono": "***787-207-5653",
	"unidades": 1,
	"updatedAt": "2016-02-25T17:53:32.592Z"
}, {
	"activo": true,
	"clave": "",
	"createdAt": "2016-02-25T18:45:08.507Z",
	"deuda": 0,
	"expiracion": "03/25/2016",
	"metodo": "Otro",
	"nombre": "Rafael J Mejias Gonzalez / Nuevo",
	"objectId": "bwljorNm7G",
	"otro": "",
	"pago": 10,
	"pueblo": "San Lorenzp",
	"servicio": "Cajas",
	"telefono": "017875956600",
	"unidades": 1,
	"updatedAt": "2016-02-25T18:45:08.507Z"
}, {
	"activo": true,
	"clave": "",
	"createdAt": "2016-02-25T21:39:55.744Z",
	"deuda": 0,
	"expiracion": "03/25/2016",
	"metodo": "Paypal",
	"nombre": "Juan Sabat / Ana Sabat",
	"objectId": "nAD0jFgSct",
	"otro": "",
	"pago": 15,
	"pueblo": "San Lorenzo",
	"servicio": "Mach Tv",
	"telefono": "+1 (787) 715-2948",
	"unidades": 1,
	"updatedAt": "2016-02-25T21:39:55.744Z"
}, {
	"activo": true,
	"clave": "",
	"createdAt": "2016-02-25T23:42:13.413Z",
	"deuda": 0,
	"expiracion": "03/25/2016",
	"metodo": "Ath Movil",
	"nombre": "Jan L Rodriguez / Yaritza Miranda",
	"objectId": "FvmEShq2su",
	"otro": "",
	"pago": 15,
	"pueblo": "San lorenzo",
	"servicio": "Pix",
	"telefono": "+1 (787) 595-6126",
	"unidades": 1,
	"updatedAt": "2016-02-25T23:42:13.413Z"
}, {
	"activo": true,
	"clave": "",
	"createdAt": "2016-02-04T22:01:43.311Z",
	"deuda": 0,
	"expiracion": "03/25/2017",
	"metodo": "Paypal",
	"nombre": "Omar ramos / Emilio Rios / Ismaly Huertas",
	"objectId": "jzkQZEpMUc",
	"otro": "",
	"pago": 10,
	"pueblo": "Santurce, Villa Keneddy",
	"servicio": "Mach Tv",
	"telefono": "+1 (787) 728-7889",
	"unidades": 1,
	"updatedAt": "2016-02-22T19:06:21.978Z"
}, {
	"activo": true,
	"clave": "",
	"createdAt": "2015-03-18T19:08:46.850Z",
	"deuda": 0,
	"expiracion": "03/26/2016",
	"metodo": "Personal",
	"nombre": "Carmen Campos (Grilla) / Nuevo",
	"objectId": "qUTLvNIqjz",
	"otro": "",
	"pago": 10,
	"pueblo": "BM",
	"servicio": "Cajas",
	"telefono": "017873594826 # equivocado /787-988-1555 ó 939-325-6953",
	"ultimo_pago": "1/8/2016 10:58 AM ($10.00) - Yai Toro",
	"unidades": 1,
	"updatedAt": "2016-02-23T18:04:16.264Z"
}, {
	"activo": true,
	"clave": "",
	"createdAt": "2015-05-17T17:03:22.086Z",
	"deuda": 0,
	"expiracion": "03/26/2016",
	"metodo": "Personal",
	"nombre": "Carmen Campos (Grilla) / Nuevo",
	"objectId": "f7EH5ORL4E",
	"otro": "",
	"pago": 10,
	"pueblo": "BM",
	"servicio": "Cajas",
	"telefono": "117873594826 # equivocado/ 787-988-1555 ó 939-325-6953",
	"ultimo_pago": "1/8/2016 10:58 AM ($10.00) - Yai Toro",
	"unidades": 1,
	"updatedAt": "2016-02-23T18:04:31.477Z"
}, {
	"activo": true,
	"clave": "",
	"createdAt": "2016-02-26T22:40:03.889Z",
	"deuda": 0,
	"expiracion": "03/26/2016",
	"metodo": "Otro",
	"nombre": "Carlos Bonilla ",
	"objectId": "4466WhQ068",
	"otro": "",
	"pago": 15,
	"pueblo": "Cayey",
	"servicio": "Mach Tv",
	"telefono": "**787*975-6277",
	"unidades": 1,
	"updatedAt": "2016-02-26T22:40:03.889Z"
}, {
	"activo": true,
	"clave": "",
	"createdAt": "2015-03-13T07:54:54.455Z",
	"deuda": 0,
	"expiracion": "03/27/2016",
	"metodo": "Personal",
	"nombre": "Manuel Vargas /  Nuevo",
	"objectId": "Af0DQ5wzKs",
	"otro": "",
	"pago": 10,
	"pueblo": "Carolina, Aros y Gomas #1",
	"servicio": "Cajas",
	"telefono": "017876039666",
	"ultimo_pago": "11/29/2015 8:03 PM Acreditado 2 meses - Yai Toro",
	"unidades": 1,
	"updatedAt": "2015-11-30T00:11:33.376Z"
}, {
	"activo": true,
	"clave": "",
	"createdAt": "2015-07-31T16:28:21.915Z",
	"deuda": 0,
	"expiracion": "03/27/2016",
	"metodo": "Paypal",
	"nombre": "Christian Cardona Soto / Delivette Gonzalez Santiago",
	"objectId": "3zhOVANw99",
	"otro": "",
	"pago": 15,
	"pueblo": "Degetao Caguas",
	"servicio": "Mach Tv",
	"telefono": "+1 (787) 518-1367",
	"ultimo_pago": "2/25/2016 9:31 PM ($15.00) - Yai Toro",
	"unidades": 1,
	"updatedAt": "2016-02-26T01:33:03.115Z"
}, {
	"activo": true,
	"clave": "",
	"createdAt": "2015-12-21T20:21:02.321Z",
	"deuda": 0,
	"expiracion": "03/27/2016",
	"metodo": "Otro",
	"nombre": "Nelida Ortiz Jimenez / 1er Roku",
	"objectId": "S6W32kACQe",
	"otro": "",
	"pago": 15,
	"pueblo": "Bayamon",
	"servicio": "Pix",
	"telefono": "+1 (787) 209-2171",
	"ultimo_pago": "2/19/2016 6:13 PM ($15.00) - Awilda Hernandez",
	"unidades": 1,
	"updatedAt": "2016-02-20T20:24:36.506Z"
}, {
	"activo": true,
	"clave": "",
	"createdAt": "2015-12-21T22:04:52.050Z",
	"deuda": 0,
	"expiracion": "03/27/2016",
	"metodo": "Ath Movil",
	"nombre": "Edgard Cortes Aguallo",
	"objectId": "4yuJFNjiCE",
	"otro": "",
	"pago": 10,
	"pueblo": "Caguas",
	"servicio": "Pix",
	"telefono": "+1 (787) 672-1808",
	"ultimo_pago": "2/21/2016 7:30 PM ($10.00) - Yai Toro",
	"unidades": 1,
	"updatedAt": "2016-02-21T23:31:32.334Z"
}, {
	"activo": true,
	"clave": "",
	"createdAt": "2015-05-26T04:00:03.036Z",
	"deuda": 0,
	"expiracion": "03/28/2016",
	"metodo": "Personal",
	"nombre": "Samuel Rosa / samuelrosa",
	"objectId": "eGLAQ0dBKQ",
	"otro": "",
	"pago": 10,
	"pueblo": "Villa de Castro / Caguas",
	"servicio": "Roku",
	"telefono": "+1 (787) 410-6174",
	"unidades": 1,
	"updatedAt": "2015-05-26T04:00:03.036Z"
}, {
	"activo": true,
	"clave": "",
	"createdAt": "2016-01-28T13:55:51.596Z",
	"deuda": 0,
	"expiracion": "03/28/2016",
	"metodo": "Personal",
	"nombre": "Edwin Camacho / Nuevo",
	"objectId": "ypituF8P8I",
	"otro": "",
	"pago": 10,
	"pueblo": "La Rampla, Aguas Buenas",
	"servicio": "Cajas",
	"telefono": "017875322428",
	"unidades": 1,
	"updatedAt": "2016-01-28T14:01:13.340Z"
}, {
	"activo": true,
	"clave": "",
	"createdAt": "2015-03-22T20:00:05.201Z",
	"deuda": 0,
	"expiracion": "03/29/2016",
	"metodo": "Personal",
	"nombre": "Rafael Ayala / 517789 / Nuevo",
	"objectId": "qHIgkMsB99",
	"otro": "",
	"pago": 10,
	"pueblo": "Camino Verde, Aguas Buenas",
	"servicio": "Cajas",
	"telefono": "017873134407",
	"ultimo_pago": "11/29/2015 11:55 AM ($40.00) - Yai Toro",
	"unidades": 1,
	"updatedAt": "2015-11-29T15:55:40.881Z"
}, {
	"activo": true,
	"clave": "",
	"createdAt": "2015-04-04T17:53:52.837Z",
	"deuda": 0,
	"expiracion": "03/29/2016",
	"metodo": "Otro",
	"nombre": "Jose Grant",
	"objectId": "56eJijzLn4",
	"otro": "",
	"pago": 15,
	"pueblo": "Juncos",
	"servicio": "Pix",
	"telefono": "+1 (787) 697-2664",
	"ultimo_pago": "2/21/2016 7:28 PM ($15.00) - Yai Toro",
	"unidades": 1,
	"updatedAt": "2016-02-21T23:30:20.768Z"
}, {
	"activo": true,
	"clave": "",
	"createdAt": "2015-04-04T18:08:56.756Z",
	"deuda": 0,
	"expiracion": "03/29/2016",
	"metodo": "Ath Movil",
	"nombre": "Luis Acevedo / Laura Rodriguez",
	"objectId": "uqdg4Tgk6q",
	"otro": "",
	"pago": 15,
	"pueblo": "Caguas",
	"servicio": "Pix",
	"telefono": "+1 (787) 410-3360",
	"ultimo_pago": "2/27/2016 9:11 PM ($15.00) - Yai Toro",
	"unidades": 1,
	"updatedAt": "2016-02-28T01:25:37.790Z"
}, {
	"activo": true,
	"clave": "",
	"createdAt": "2015-10-26T23:28:40.094Z",
	"deuda": 0,
	"expiracion": "03/29/2016",
	"metodo": "Personal",
	"nombre": "Yamaris Mojica",
	"objectId": "aI0ezsFsN5",
	"otro": "",
	"pago": 15,
	"pueblo": "Humacao",
	"servicio": "Pix",
	"telefono": "+1 (787) 649-0629",
	"ultimo_pago": "2/27/2016 12:02 PM ($15.00) - Yai Toro",
	"unidades": 1,
	"updatedAt": "2016-02-27T16:03:26.615Z"
}, {
	"activo": true,
	"clave": "",
	"createdAt": "2015-11-18T23:44:40.255Z",
	"deuda": 0,
	"expiracion": "03/29/2016",
	"metodo": "Ath Movil",
	"nombre": "Denisse Gonzalez",
	"objectId": "tLj1AyQbuA",
	"otro": "",
	"pago": 15,
	"pueblo": "Caguas",
	"servicio": "Mach Tv",
	"telefono": "+1 (939) 325-0221",
	"ultimo_pago": "2/27/2016 9:56 PM ($15.00) - Yai Toro",
	"unidades": 1,
	"updatedAt": "2016-02-28T01:56:49.497Z"
}, {
	"activo": true,
	"clave": "",
	"createdAt": "2016-01-25T21:56:30.428Z",
	"deuda": 0,
	"expiracion": "03/29/2016",
	"metodo": "Ath Movil",
	"nombre": "Karen Suarez",
	"objectId": "RA4UvhYMcz",
	"otro": "",
	"pago": 15,
	"pueblo": "Cayey",
	"servicio": "Pix",
	"telefono": "+1 (787) 685-6360",
	"ultimo_pago": "2/27/2016 8:54 PM ($15.00) - Yai Toro",
	"unidades": 1,
	"updatedAt": "2016-02-28T00:54:39.225Z"
}, {
	"activo": true,
	"clave": "",
	"createdAt": "2015-03-13T07:54:54.754Z",
	"deuda": 0,
	"expiracion": "03/30/2016",
	"metodo": "Ath Movil",
	"nombre": "Julio Concepcion / Hijo /Nuevo",
	"objectId": "M9Pc8LUMos",
	"otro": "",
	"pago": 10,
	"pueblo": "Rio Verde, Caguas",
	"servicio": "Cajas",
	"telefono": "017876853062",
	"ultimo_pago": "1/30/2016 1:11 AM ($20.00) - Yai Toro",
	"unidades": 1,
	"updatedAt": "2016-01-30T05:12:13.124Z"
}, {
	"activo": true,
	"clave": "",
	"createdAt": "2015-03-23T03:43:23.297Z",
	"deuda": 0,
	"expiracion": "03/30/2016",
	"metodo": "Correo",
	"nombre": "Edwin Ramirez / Nuevo",
	"objectId": "iTD2WSZ2Fa",
	"otro": "",
	"pago": 10,
	"pueblo": "Cayey",
	"servicio": "Cajas",
	"telefono": "017875574411",
	"ultimo_pago": "1/1/2016 10:59 PM Acreditado 1 mes - Yai Toro",
	"unidades": 1,
	"updatedAt": "2016-01-02T03:00:14.199Z"
}, {
	"activo": true,
	"clave": "",
	"createdAt": "2015-04-04T15:29:52.062Z",
	"deuda": 0,
	"expiracion": "03/30/2016",
	"metodo": "Paypal",
	"nombre": "Carlos Rodriguez",
	"objectId": "Unquz0vXH5",
	"otro": "",
	"pago": 15,
	"pueblo": "Caguas",
	"servicio": "Pix",
	"telefono": "+1 (787) 246-1282",
	"ultimo_pago": "2/27/2016 8:40 PM ($15.00) - Yai Toro",
	"unidades": 1,
	"updatedAt": "2016-02-28T00:40:43.369Z"
}, {
	"activo": true,
	"clave": "",
	"createdAt": "2015-05-26T03:05:09.943Z",
	"deuda": 0,
	"expiracion": "03/30/2016",
	"metodo": "Otro",
	"nombre": "Omayra Mercado",
	"objectId": "pdxpfuTER9",
	"otro": "Personal se le dio 1 crédito por Carmen Llera hasta 10/25/15",
	"pago": 10,
	"pueblo": "Aguas Buenas",
	"servicio": "Pix",
	"telefono": "+1 (787) 638-5592",
	"ultimo_pago": "2/14/2016 5:12 PM ($10.00) - Yai Toro",
	"unidades": 1,
	"updatedAt": "2016-02-14T21:13:18.527Z"
}, {
	"activo": true,
	"clave": "",
	"createdAt": "2015-06-28T15:10:18.739Z",
	"deuda": 0,
	"expiracion": "03/30/2016",
	"metodo": "Paypal",
	"nombre": "Carlos Rodriguez",
	"objectId": "s78OAlqcUa",
	"otro": "",
	"pago": 10,
	"pueblo": "Caguas",
	"servicio": "Mach Tv",
	"telefono": "-1 (787) 246-1282",
	"ultimo_pago": "2/27/2016 8:41 PM ($10.00) - Yai Toro",
	"unidades": 1,
	"updatedAt": "2016-02-28T00:41:20.298Z"
}, {
	"activo": true,
	"clave": "",
	"createdAt": "2015-05-28T20:06:07.430Z",
	"deuda": 0,
	"expiracion": "03/30/2016",
	"metodo": "Otro",
	"nombre": "Carmen Reyes Hernandez / Nuevo",
	"objectId": "SspcbOUeOl",
	"otro": "",
	"pago": 10,
	"pueblo": "",
	"servicio": "Cajas",
	"telefono": "017872103384",
	"ultimo_pago": "12/23/2015 3:30 PM ($30.00) - Flor Rivera",
	"unidades": 1,
	"updatedAt": "2016-02-04T20:18:08.004Z"
}, {
	"activo": true,
	"clave": "",
	"createdAt": "2015-10-27T13:53:35.849Z",
	"deuda": 0,
	"expiracion": "03/30/2016",
	"metodo": "Ath Movil",
	"nombre": "Mirna Diaz / Kreneley Diaz",
	"objectId": "jEJolhN0id",
	"otro": "",
	"pago": 10,
	"pueblo": "Caguas",
	"servicio": "Mach Tv",
	"telefono": "*787-640-4651",
	"ultimo_pago": "2/27/2016 8:45 PM ($10.00) - Yai Toro",
	"unidades": 1,
	"updatedAt": "2016-02-28T00:47:08.973Z"
}, {
	"activo": true,
	"clave": "",
	"createdAt": "2016-02-28T00:39:05.369Z",
	"deuda": 0,
	"expiracion": "03/30/2016",
	"metodo": "Ath Movil",
	"nombre": "Carlos Agosto / Nicole Hernandez",
	"objectId": "XpIgJbOpEY",
	"otro": "",
	"pago": 15,
	"pueblo": "Arecibo",
	"servicio": "Pix",
	"telefono": "+1 (787) 635-4492",
	"ultimo_pago": "2/27/2016 8:39 PM ($15.00) - Yai Toro",
	"unidades": 1,
	"updatedAt": "2016-02-28T00:39:19.920Z"
}, {
	"activo": true,
	"clave": "",
	"createdAt": "2015-03-13T07:54:55.873Z",
	"deuda": 0,
	"expiracion": "03/31/2016",
	"metodo": "Personal",
	"nombre": "Nelson Oquendo / Nuevo",
	"objectId": "WFvR1Jtts3",
	"otro": "",
	"pago": 10,
	"pueblo": "San Lorenzo",
	"servicio": "Cajas",
	"telefono": "017876157247",
	"unidades": 1,
	"updatedAt": "2015-05-10T22:34:50.634Z"
}, {
	"activo": true,
	"clave": "",
	"createdAt": "2015-10-27T13:52:54.266Z",
	"deuda": 0,
	"expiracion": "03/31/2016",
	"metodo": "Ath Movil",
	"nombre": "Mirna Diaz / Kreneley Diaz",
	"objectId": "MXf1kHiIy0",
	"otro": "",
	"pago": 15,
	"pueblo": "Caguas",
	"servicio": "Pix",
	"telefono": "+1 (787) 640-4651",
	"ultimo_pago": "2/27/2016 8:45 PM ($15.00) - Yai Toro",
	"unidades": 1,
	"updatedAt": "2016-02-28T00:46:33.315Z"
}, {
	"activo": true,
	"clave": "",
	"createdAt": "2015-07-17T17:04:14.622Z",
	"deuda": 0,
	"expiracion": "04/01/2016",
	"metodo": "Otro",
	"nombre": "Wilfredo Vazquez / Flasho / Nuevo",
	"objectId": "XwbUqNGcib",
	"otro": "Se le dio credito por Ricardo Lopez 2/26/16",
	"pago": 10,
	"pueblo": "Bm, Villa Turabo Caguas",
	"servicio": "Cajas",
	"telefono": "017876729313",
	"ultimo_pago": "2/26/2016 5:00 PM Acreditado 1 mes - Flor Rivera",
	"unidades": 1,
	"updatedAt": "2016-03-01T15:13:49.668Z"
}, {
	"activo": true,
	"clave": "",
	"createdAt": "2015-09-21T17:20:20.225Z",
	"deuda": 0,
	"expiracion": "04/01/2016",
	"metodo": "Otro",
	"nombre": "Cristian Reyes Rosario / Nuevo",
	"objectId": "mWmanP2KH3",
	"otro": "",
	"pago": 10,
	"pueblo": "Canovana",
	"servicio": "Cajas",
	"telefono": "017873786580",
	"ultimo_pago": "2/1/2016 4:28 PM ($20.00) - Awilda Hernandez",
	"unidades": 1,
	"updatedAt": "2016-02-01T20:29:50.722Z"
}, {
	"activo": true,
	"clave": "",
	"createdAt": "2015-11-23T14:07:54.277Z",
	"deuda": 0,
	"expiracion": "04/01/2016",
	"metodo": "Otro",
	"nombre": "Merian Lugo",
	"objectId": "zRE70mCqdF",
	"otro": "",
	"pago": 10,
	"pueblo": "Humaca0",
	"servicio": "Cajas",
	"telefono": "017872168927",
	"ultimo_pago": "2/1/2016 6:32 PM ($20.00) - Awilda Hernandez",
	"unidades": 1,
	"updatedAt": "2016-02-01T22:34:08.769Z"
}, {
	"activo": true,
	"clave": "",
	"createdAt": "2016-01-22T03:08:04.798Z",
	"deuda": 0,
	"expiracion": "04/01/2016",
	"metodo": "Otro",
	"nombre": "Wilfredo Vazquez  / Flasho",
	"objectId": "Aq4tv2f0cM",
	"otro": "Se le dio credito por Ricardo Lopez 2/26/16",
	"pago": 35,
	"pueblo": "Villa Turabo, Caguas",
	"servicio": "Internet 5M",
	"telefono": "+1 (787) 672-9313",
	"ultimo_pago": "2/26/2016 5:03 PM ($35.00) - Flor Rivera",
	"unidades": 1,
	"updatedAt": "2016-03-01T15:13:58.776Z"
}, {
	"activo": true,
	"clave": "",
	"createdAt": "2016-02-01T17:12:59.812Z",
	"deuda": 0,
	"expiracion": "04/01/2016",
	"metodo": "Otro",
	"nombre": "Gina Sierra Rivera ",
	"objectId": "ZIs03FGnyt",
	"otro": "",
	"pago": 15,
	"pueblo": "Cidra",
	"servicio": "Mach Tv",
	"telefono": "+1 (787) 557-9138",
	"unidades": 1,
	"updatedAt": "2016-02-01T17:12:59.812Z"
}, {
	"activo": true,
	"clave": "",
	"createdAt": "2016-03-01T18:15:06.703Z",
	"deuda": 0,
	"expiracion": "04/01/2016",
	"metodo": "Otro",
	"nombre": "Luis Leon Medina",
	"objectId": "RJLWefF0kS",
	"otro": "",
	"pago": 10,
	"pueblo": "Caguas",
	"servicio": "Cajas",
	"telefono": "017872998038",
	"unidades": 1,
	"updatedAt": "2016-03-01T18:15:06.703Z"
}, {
	"activo": true,
	"clave": "",
	"createdAt": "2016-03-01T18:15:34.832Z",
	"deuda": 0,
	"expiracion": "04/01/2016",
	"metodo": "Otro",
	"nombre": "Luis Leon Medina",
	"objectId": "0wTGppDrIu",
	"otro": "",
	"pago": 10,
	"pueblo": "Caguas",
	"servicio": "Cajas",
	"telefono": "117872998038",
	"unidades": 1,
	"updatedAt": "2016-03-01T18:15:34.832Z"
}, {
	"activo": true,
	"clave": "",
	"createdAt": "2016-03-01T18:16:02.500Z",
	"deuda": 0,
	"expiracion": "04/01/2016",
	"metodo": "Otro",
	"nombre": "Luis Leon Medina",
	"objectId": "YCFcR527Zx",
	"otro": "",
	"pago": 18,
	"pueblo": "Caguas",
	"servicio": "Internet 2M",
	"telefono": "+1 (787) 299-8038",
	"unidades": 1,
	"updatedAt": "2016-03-01T18:16:02.500Z"
}, {
	"activo": true,
	"clave": "",
	"createdAt": "2016-03-01T19:47:43.357Z",
	"deuda": 0,
	"expiracion": "04/01/2016",
	"metodo": "Personal",
	"nombre": "Aida L Valle",
	"objectId": "Sj2rmjGeox",
	"otro": "",
	"pago": 10,
	"pueblo": "Caguas",
	"servicio": "Mach Tv",
	"telefono": "+1 (939) 397-0931",
	"unidades": 1,
	"updatedAt": "2016-03-01T19:47:43.357Z"
}, {
	"activo": true,
	"clave": "",
	"createdAt": "2015-04-29T13:01:13.982Z",
	"deuda": 0,
	"expiracion": "04/03/2016",
	"metodo": "Ath Movil",
	"nombre": "Carmen Rodriguez",
	"objectId": "l0jSEvpFq9",
	"otro": "",
	"pago": 15,
	"pueblo": "Cataño",
	"servicio": "Mach Tv",
	"telefono": "+1 (787) 403-9961",
	"ultimo_pago": "2/27/2016 8:53 PM ($15.00) - Yai Toro",
	"unidades": 1,
	"updatedAt": "2016-02-28T00:53:29.115Z"
}, {
	"activo": true,
	"clave": "",
	"createdAt": "2015-11-17T22:29:59.096Z",
	"deuda": 0,
	"expiracion": "04/03/2016",
	"metodo": "Otro",
	"nombre": "Rafael Delgado Massa",
	"objectId": "3MMARQ5nnW",
	"otro": "",
	"pago": 10,
	"pueblo": "Juncos",
	"servicio": "Cajas",
	"telefono": "117879092124",
	"ultimo_pago": "3/3/2016 6:57 PM Acreditado 1 mes - Awilda Hernandez",
	"unidades": 1,
	"updatedAt": "2016-03-03T22:58:29.737Z"
}, {
	"activo": true,
	"clave": "",
	"createdAt": "2015-03-13T07:54:55.398Z",
	"deuda": 0,
	"expiracion": "04/04/2016",
	"metodo": "Paypal",
	"nombre": "Ada Vega / Miguel Rodriguez / Nuevo",
	"objectId": "YXXVlye3dU",
	"otro": "",
	"pago": 10,
	"pueblo": "Jardines, Gurabo",
	"servicio": "Cajas",
	"telefono": "017874696445",
	"ultimo_pago": "2/24/2016 11:27 AM ($10.00) - Awilda Hernandez",
	"unidades": 1,
	"updatedAt": "2016-02-24T15:29:20.379Z"
}, {
	"activo": true,
	"clave": "",
	"createdAt": "2015-03-13T07:54:54.360Z",
	"deuda": 0,
	"expiracion": "04/04/2016",
	"metodo": "Personal",
	"nombre": "Mayra Colon / Nuevo",
	"objectId": "egPiNikDm4",
	"otro": "",
	"pago": 10,
	"pueblo": "BM",
	"servicio": "Cajas",
	"telefono": "017875315205 # equivocado",
	"ultimo_pago": "2/26/2016 8:59 AM ($10.00) - Yai Toro",
	"unidades": 1,
	"updatedAt": "2016-02-26T12:59:08.660Z"
}, {
	"activo": true,
	"clave": "",
	"createdAt": "2015-05-17T17:52:45.634Z",
	"deuda": 0,
	"expiracion": "04/04/2016",
	"metodo": "Paypal",
	"nombre": "Ada Vega / Miguel Rodriguez / Nuevo",
	"objectId": "1O5WLjI7Rf",
	"otro": "",
	"pago": 10,
	"pueblo": "Jardines De Gurabo",
	"servicio": "Cajas",
	"telefono": "117874696445",
	"ultimo_pago": "2/24/2016 11:27 AM ($10.00) - Awilda Hernandez",
	"unidades": 1,
	"updatedAt": "2016-02-24T15:29:33.719Z"
}, {
	"activo": true,
	"clave": "",
	"createdAt": "2015-05-10T19:31:43.523Z",
	"deuda": 0,
	"expiracion": "04/05/2016",
	"metodo": "Personal",
	"nombre": "Carlos Ramos / Nuevo",
	"objectId": "cZVGMjZPaJ",
	"otro": "",
	"pago": 10,
	"pueblo": "Maunabo",
	"servicio": "Cajas",
	"telefono": "017874500831",
	"ultimo_pago": "2/5/2016 7:19 PM ($20.00) - Yai Toro",
	"unidades": 1,
	"updatedAt": "2016-02-05T23:19:13.423Z"
}, {
	"activo": true,
	"clave": "",
	"createdAt": "2015-10-02T22:00:37.561Z",
	"deuda": 0,
	"expiracion": "04/05/2016",
	"metodo": "Correo",
	"nombre": "Guillermo Arroyo Lebron",
	"objectId": "O9HgYfEkln",
	"otro": "",
	"pago": 15,
	"pueblo": "Humacao",
	"servicio": "Pix",
	"telefono": "*787-514-5511",
	"ultimo_pago": "2/20/2016 2:03 PM ($15.00) - Yai Toro",
	"unidades": 1,
	"updatedAt": "2016-02-20T18:43:24.037Z"
}, {
	"activo": true,
	"clave": "",
	"createdAt": "2015-10-29T15:35:41.439Z",
	"deuda": 0,
	"expiracion": "04/05/2016",
	"metodo": "Paypal",
	"nombre": "Rafael Maisonet",
	"objectId": "HEmbg5xYqV",
	"otro": "",
	"pago": 15,
	"pueblo": "Caguas",
	"servicio": "Mach Tv",
	"telefono": "+1 (787) 746-2265",
	"ultimo_pago": "2/5/2016 2:39 PM ($15.00) - Awilda Hernandez",
	"unidades": 1,
	"updatedAt": "2016-02-05T18:42:05.038Z"
}, {
	"activo": true,
	"clave": "",
	"createdAt": "2015-12-08T00:08:49.989Z",
	"deuda": 0,
	"expiracion": "04/09/2016",
	"metodo": "Paypal",
	"nombre": "Shalymar Santos De Jesus / Steven hijo Gina",
	"objectId": "AWNCJAOKh5",
	"otro": "",
	"pago": 15,
	"pueblo": "Caimito",
	"servicio": "Mach Tv",
	"telefono": "+1 (787) 385-0185",
	"ultimo_pago": "2/28/2016 8:59 PM ($15.00) - Yai Toro",
	"unidades": 1,
	"updatedAt": "2016-02-29T00:59:48.990Z"
}, {
	"activo": true,
	"clave": "",
	"createdAt": "2016-01-07T20:42:16.787Z",
	"deuda": 0,
	"expiracion": "04/09/2016",
	"metodo": "Paypal",
	"nombre": "Andreliz Cubano",
	"objectId": "hMJ8k5xhjV",
	"otro": "",
	"pago": 15,
	"pueblo": "Fajardo",
	"servicio": "Mach Tv",
	"telefono": "+1 (787) 435-1605",
	"ultimo_pago": "2/7/2016 12:06 PM ($30.00) - Yai Toro",
	"unidades": 1,
	"updatedAt": "2016-02-07T16:07:02.667Z"
}, {
	"activo": true,
	"clave": "",
	"createdAt": "2015-03-13T07:54:55.284Z",
	"deuda": 0,
	"expiracion": "04/11/2016",
	"metodo": "Paypal",
	"nombre": "Luis Berrios / Nuevo",
	"objectId": "eQeHqkHAwl",
	"otro": "",
	"pago": 10,
	"pueblo": "Bayamon",
	"servicio": "Cajas",
	"telefono": "017879227682",
	"unidades": 1,
	"updatedAt": "2015-04-12T17:04:45.432Z"
}, {
	"activo": true,
	"clave": "",
	"createdAt": "2015-03-13T07:54:55.019Z",
	"deuda": 0,
	"expiracion": "04/16/2016",
	"metodo": "Paypal",
	"nombre": "Maria Gonzalez / Maricarmen / Nuevo",
	"objectId": "bb7l7jp6n6",
	"otro": "",
	"pago": 10,
	"pueblo": "Guaynabo",
	"servicio": "Cajas",
	"telefono": "017873644833",
	"ultimo_pago": "12/16/2015 6:12 PM Acreditado 4 meses - Yai Toro",
	"unidades": 1,
	"updatedAt": "2015-12-16T22:14:59.536Z"
}, {
	"activo": true,
	"clave": "",
	"createdAt": "2015-03-22T14:23:02.285Z",
	"deuda": 0,
	"expiracion": "04/17/2016",
	"metodo": "Personal",
	"nombre": "Iara Gonzalez / Angel / Nuevo",
	"objectId": "YpmRr5pRnr",
	"otro": "",
	"pago": 10,
	"pueblo": "El Pueblo, Caguas",
	"servicio": "Cajas",
	"telefono": "017879438925 / 787-479-4623",
	"ultimo_pago": "12/17/2015 12:48 PM ($30.00) - Flor Rivera",
	"unidades": 1,
	"updatedAt": "2015-12-17T18:49:34.788Z"
}, {
	"activo": true,
	"clave": "",
	"createdAt": "2015-05-26T02:44:24.062Z",
	"deuda": 0,
	"expiracion": "04/17/2016",
	"metodo": "Paypal",
	"nombre": "Iris Casilla / Hermano",
	"objectId": "JRGtFAZF4r",
	"otro": "",
	"pago": 10,
	"pueblo": "Las Piedras",
	"servicio": "Pix",
	"telefono": "-1 (787) 718-9259",
	"unidades": 1,
	"updatedAt": "2015-06-17T20:21:35.597Z"
}, {
	"activo": true,
	"clave": "",
	"createdAt": "2015-03-13T07:54:54.727Z",
	"deuda": 0,
	"expiracion": "04/18/2016",
	"metodo": "Correo",
	"nombre": "Rafael De Jesus Rivera / Glorivi de Jesus / Nuevo",
	"objectId": "fCXWHvHVVu",
	"otro": "",
	"pago": 10,
	"pueblo": "San Lorenzo",
	"servicio": "Cajas",
	"telefono": "017876360340 / 787-322-3718",
	"unidades": 1,
	"updatedAt": "2016-02-18T23:21:54.323Z"
}, {
	"activo": true,
	"clave": "",
	"createdAt": "2015-03-22T20:40:40.050Z",
	"deuda": 0,
	"expiracion": "04/19/2016",
	"metodo": "Correo",
	"nombre": "Osvaldo Tirado / Azalea / Nuevo",
	"objectId": "DdblN5kehZ",
	"otro": "",
	"pago": 10,
	"pueblo": "Villa Espana, Bayamon",
	"servicio": "Cajas",
	"telefono": "017874540920 / 787-740-0881 / 787-316-5509",
	"ultimo_pago": "8/14/2015 11:38 AM ($70.00) - Awilda Hernandez",
	"unidades": 1,
	"updatedAt": "2016-01-19T19:14:55.620Z"
}, {
	"activo": true,
	"clave": "",
	"createdAt": "2015-05-17T19:17:28.172Z",
	"deuda": 0,
	"expiracion": "04/20/2016",
	"metodo": "Paypal",
	"nombre": "Jesus Poueriet / Cuato Mama /  Nuevo",
	"objectId": "UXrfRZpweB",
	"otro": "",
	"pago": 10,
	"pueblo": "Bo Obrero, Santurce 3 monjitas ",
	"servicio": "Cajas",
	"telefono": "117876395632",
	"ultimo_pago": "1/15/2016 12:45 PM ($30.00) - Yai Toro",
	"unidades": 1,
	"updatedAt": "2016-01-20T20:43:38.685Z"
}, {
	"activo": true,
	"clave": "",
	"createdAt": "2015-03-20T20:39:05.164Z",
	"deuda": 0,
	"expiracion": "04/21/2016",
	"metodo": "Personal",
	"nombre": "William Borges / Nuevo",
	"objectId": "BWivcTsotJ",
	"otro": "",
	"pago": 10,
	"pueblo": "San Lorenzo",
	"servicio": "Cajas",
	"telefono": "017873825832",
	"ultimo_pago": "1/21/2016 4:31 PM ($30.00) - Awilda Hernandez",
	"unidades": 1,
	"updatedAt": "2016-01-21T20:32:31.802Z"
}, {
	"activo": true,
	"clave": "",
	"createdAt": "2015-03-23T03:46:22.789Z",
	"deuda": 0,
	"expiracion": "04/21/2016",
	"metodo": "Personal",
	"nombre": "Francisca Calderon (Panchy) /  Nuevo",
	"objectId": "Ka9U39exkS",
	"otro": "",
	"pago": 10,
	"pueblo": "Villa Guadalupe, Caguas",
	"servicio": "Cajas",
	"telefono": "017879383095",
	"ultimo_pago": "2/21/2016 7:28 PM ($20.00) - Yai Toro",
	"unidades": 1,
	"updatedAt": "2016-02-21T23:28:05.406Z"
}, {
	"activo": true,
	"clave": "",
	"createdAt": "2015-11-20T13:52:18.925Z",
	"deuda": 0,
	"expiracion": "04/22/2016",
	"metodo": "Otro",
	"nombre": "Yolanda Prado / Nuevo",
	"objectId": "FulkJcprsB",
	"otro": "",
	"pago": 10,
	"pueblo": "Juncos",
	"servicio": "Cajas",
	"telefono": "017872051840",
	"ultimo_pago": "12/22/2015 7:32 PM ($20.00) - Awilda Hernandez",
	"unidades": 1,
	"updatedAt": "2015-12-22T23:32:22.766Z"
}, {
	"activo": true,
	"clave": "",
	"createdAt": "2015-03-19T00:23:42.836Z",
	"deuda": 0,
	"expiracion": "04/24/2016",
	"metodo": "Paypal",
	"nombre": "Alfred Campos / 517677",
	"objectId": "OrGh5RPtTk",
	"otro": "",
	"pago": 10,
	"pueblo": "Tejas, Las Piedras",
	"servicio": "Cajas",
	"telefono": "017872426889",
	"unidades": 1,
	"updatedAt": "2015-12-24T21:25:19.071Z"
}, {
	"activo": true,
	"clave": "",
	"createdAt": "2015-12-24T18:48:10.329Z",
	"deuda": 0,
	"expiracion": "04/24/2016",
	"metodo": "Ath Movil",
	"nombre": "Carlos Rosa / Carlitos Taca / 2do Roku",
	"objectId": "XVG9v0HG56",
	"otro": "",
	"pago": 15,
	"pueblo": "Caguas",
	"servicio": "Mach Tv",
	"telefono": "**787-568-7768",
	"unidades": 1,
	"updatedAt": "2015-12-24T18:48:10.329Z"
}, {
	"activo": true,
	"clave": "",
	"createdAt": "2015-03-13T07:54:54.635Z",
	"deuda": 0,
	"expiracion": "04/26/2016",
	"metodo": "Paypal",
	"nombre": "Iris Casilla / Edgardo Antonio Cruz / Caja Mama / Nuevo",
	"objectId": "g5j9Vh9Bl2",
	"otro": "",
	"pago": 10,
	"pueblo": "Las Piedras",
	"servicio": "Cajas",
	"telefono": "017879125858 / 787-718-9259 / 787-733-5248",
	"ultimo_pago": "10/22/2015 6:34 PM ($30.00) - Flor Rivera",
	"unidades": 1,
	"updatedAt": "2016-01-28T02:32:04.199Z"
}, {
	"activo": true,
	"clave": "",
	"createdAt": "2015-03-20T20:57:23.023Z",
	"deuda": 0,
	"expiracion": "04/27/2016",
	"metodo": "Personal",
	"nombre": "Pedro Soto / Nuevo",
	"objectId": "3G26ZImmjj",
	"otro": "",
	"pago": 10,
	"pueblo": "Turabo Gardens, Caguas",
	"servicio": "Cajas",
	"telefono": "017874692994",
	"ultimo_pago": "10/23/2015 4:32 PM ($60.00) - Awilda Hernandez",
	"unidades": 1,
	"updatedAt": "2016-02-02T00:00:55.141Z"
}, {
	"activo": true,
	"clave": "",
	"createdAt": "2015-04-04T17:02:43.916Z",
	"deuda": 0,
	"expiracion": "04/29/2016",
	"metodo": "Otro",
	"nombre": "Eddie Rodriguez /Nuevo",
	"objectId": "cE1SoVzI5l",
	"otro": "9/23/15 Se le dio credito por los clientes Rafael Colon, Angel Ramos, Angel De Jesus",
	"pago": 10,
	"pueblo": "Certeneja, Cidra",
	"servicio": "Cajas",
	"telefono": "017873287768 / 7874697060",
	"ultimo_pago": "2/19/2016 7:56 PM ($10.00) - Awilda Hernandez",
	"unidades": 1,
	"updatedAt": "2016-02-19T23:57:58.715Z"
}, {
	"activo": true,
	"clave": "",
	"createdAt": "2015-05-18T02:15:10.324Z",
	"deuda": 0,
	"expiracion": "04/29/2016",
	"metodo": "Otro",
	"nombre": "Eddie Rodriguez / Nuevo",
	"objectId": "RfAaA1hg1G",
	"otro": "9/23/15 Se le dio credito por los clientes Rafael Colon, Angel Ramos, Angel De Jesus",
	"pago": 10,
	"pueblo": "Certeneja , Cidra",
	"servicio": "Cajas",
	"telefono": "117873287768 / 7874697060",
	"ultimo_pago": "2/19/2016 7:56 PM ($10.00) - Awilda Hernandez",
	"unidades": 1,
	"updatedAt": "2016-02-19T23:58:09.422Z"
}, {
	"activo": true,
	"clave": "",
	"createdAt": "2015-04-29T22:31:23.751Z",
	"deuda": 0,
	"expiracion": "05/01/2016",
	"metodo": "Personal",
	"nombre": "Aucusto Cesar Nieves / Nuevo",
	"objectId": "Fe8zIwToel",
	"otro": "",
	"pago": 10,
	"pueblo": "Aguas Buenas",
	"servicio": "Cajas",
	"telefono": "017873424074 ó 787-934-3790",
	"ultimo_pago": "3/1/2016 2:08 PM ($20.00) - Flor Rivera",
	"unidades": 1,
	"updatedAt": "2016-03-02T16:36:38.613Z"
}, {
	"activo": true,
	"clave": "",
	"createdAt": "2015-12-24T15:09:26.219Z",
	"deuda": 0,
	"expiracion": "05/01/2016",
	"metodo": "Personal",
	"nombre": "Orlando Serrano",
	"objectId": "K7GZSc1ce7",
	"otro": "",
	"pago": 10,
	"pueblo": "San Lorenzo",
	"servicio": "Pix",
	"telefono": "**787-319-2823",
	"ultimo_pago": "2/29/2016 12:32 PM ($10.00) - Flor Rivera",
	"unidades": 1,
	"updatedAt": "2016-02-29T16:35:10.691Z"
}, {
	"activo": true,
	"clave": "",
	"createdAt": "2016-03-01T19:54:32.379Z",
	"deuda": 0,
	"expiracion": "05/01/2016",
	"metodo": "Personal",
	"nombre": "Ruben Calderin",
	"objectId": "sj58ANXby8",
	"otro": "",
	"pago": 15,
	"pueblo": "Caguas",
	"servicio": "Mach Tv",
	"telefono": "+1 (787) 387-9533",
	"unidades": 1,
	"updatedAt": "2016-03-01T19:54:32.379Z"
}, {
	"activo": true,
	"clave": "",
	"createdAt": "2015-10-31T02:28:32.901Z",
	"deuda": 0,
	"expiracion": "05/02/2016",
	"metodo": "Otro",
	"nombre": "Juan Sanchez / Nuevos",
	"objectId": "ep2dnVSc1l",
	"otro": "",
	"pago": 10,
	"pueblo": "Aguas Buenas",
	"servicio": "Cajas",
	"telefono": "017872333179",
	"ultimo_pago": "3/2/2016 12:34 PM ($20.00) - Yai Toro",
	"unidades": 1,
	"updatedAt": "2016-03-02T16:34:44.044Z"
}, {
	"activo": true,
	"clave": "",
	"createdAt": "2015-03-20T19:43:44.935Z",
	"deuda": 0,
	"expiracion": "05/03/2016",
	"metodo": "Personal",
	"nombre": "Laureano Gonzalez Ortega / Nuevo",
	"objectId": "O0bQJptOAR",
	"otro": "",
	"pago": 10,
	"pueblo": "Caguas",
	"servicio": "Cajas",
	"telefono": "017873927211",
	"ultimo_pago": "2/3/2016 4:31 PM ($30.00) - Awilda Hernandez",
	"unidades": 1,
	"updatedAt": "2016-02-05T14:51:27.712Z"
}, {
	"activo": true,
	"clave": "",
	"createdAt": "2016-01-20T23:28:13.021Z",
	"deuda": 0,
	"expiracion": "05/03/2016",
	"metodo": "Ath Movil",
	"nombre": "Noel Tirado Cruz",
	"objectId": "f0hNQGk1FP",
	"otro": "",
	"pago": 15,
	"pueblo": "Humacao",
	"servicio": "Pix",
	"telefono": "787-922-2820 / 787-258-2983",
	"ultimo_pago": "3/3/2016 2:46 PM ($30.00) - Awilda Hernandez",
	"unidades": 1,
	"updatedAt": "2016-03-03T18:47:51.809Z"
}, {
	"activo": true,
	"clave": "",
	"createdAt": "2015-03-20T18:29:43.834Z",
	"deuda": 0,
	"expiracion": "05/04/2016",
	"metodo": "Personal",
	"nombre": "Steve Perez / Nuevo",
	"objectId": "fxGlsN0QiF",
	"otro": "",
	"pago": 10,
	"pueblo": "Jardnes de Gurabo, Gurabo",
	"servicio": "Cajas",
	"telefono": "017872350335",
	"ultimo_pago": "10/13/2015 7:21 PM ($60.00) - Awilda Hernandez",
	"unidades": 1,
	"updatedAt": "2016-01-04T15:56:14.904Z"
}, {
	"activo": true,
	"clave": "",
	"createdAt": "2016-02-10T00:03:12.373Z",
	"deuda": 0,
	"expiracion": "05/09/2016",
	"metodo": "Ath Movil",
	"nombre": "Jose Luis Laracuente",
	"objectId": "homDfrt8SR",
	"otro": "",
	"pago": 10,
	"pueblo": "Toa Baja",
	"servicio": "Cajas",
	"telefono": "219396304005",
	"unidades": 1,
	"updatedAt": "2016-02-10T00:04:39.222Z"
}, {
	"activo": true,
	"clave": "",
	"createdAt": "2015-03-13T07:54:55.541Z",
	"deuda": 0,
	"expiracion": "05/11/2016",
	"metodo": "Otro",
	"nombre": "Pablo Perez / Nuevo",
	"objectId": "f88YL2mG6L",
	"otro": "???",
	"pago": 10,
	"pueblo": "Gurabo",
	"servicio": "Cajas",
	"telefono": "017873782808",
	"ultimo_pago": "11/6/2015 11:35 AM ($60.00) - Awilda Hernandez",
	"unidades": 1,
	"updatedAt": "2016-01-11T23:57:17.578Z"
}, {
	"activo": true,
	"clave": "",
	"createdAt": "2015-03-21T03:15:13.159Z",
	"deuda": 0,
	"expiracion": "05/14/2016",
	"metodo": "Otro",
	"nombre": "Julio Rodriguez / Nuevo",
	"objectId": "Z0LQjakaIQ",
	"otro": "Paga en Hima",
	"pago": 10,
	"pueblo": "Gurabo",
	"servicio": "Cajas",
	"telefono": "017874475582",
	"ultimo_pago": "2/14/2016 12:58 AM ($30.00) - Yai Toro",
	"unidades": 1,
	"updatedAt": "2016-02-14T04:58:14.751Z"
}, {
	"activo": true,
	"clave": "",
	"createdAt": "2015-05-17T23:16:46.471Z",
	"deuda": 0,
	"expiracion": "05/14/2016",
	"metodo": "Otro",
	"nombre": "Luis Santiago (Papo) / Nuevo",
	"objectId": "fVlIaKxwoc",
	"otro": "Se le dio 2 creditos autorizado por Yamil 2/19/16 Cuando el cliente pague en Mayo no actualizar en raza , tiene un credito demas.",
	"pago": 10,
	"pueblo": "Rincon, Cidra",
	"servicio": "Cajas",
	"telefono": "017872437062",
	"ultimo_pago": "2/19/2016 6:38 PM Acreditado 1 mes - Flor Rivera",
	"unidades": 1,
	"updatedAt": "2016-02-19T22:39:46.429Z"
}, {
	"activo": true,
	"clave": "",
	"createdAt": "2015-06-10T22:03:20.089Z",
	"deuda": 0,
	"expiracion": "05/14/2016",
	"metodo": "Otro",
	"nombre": "David Ortiz /Nuevo",
	"objectId": "zGZ1jkPdm3",
	"otro": "",
	"pago": 10,
	"pueblo": "Caguas",
	"servicio": "Cajas",
	"telefono": "017872048053 /787-201-4882",
	"ultimo_pago": "12/10/2015 1:54 PM ($50.00) - Awilda Hernandez",
	"unidades": 1,
	"updatedAt": "2015-12-10T17:56:25.893Z"
}, {
	"activo": true,
	"clave": "",
	"createdAt": "2015-06-10T22:04:05.208Z",
	"deuda": 0,
	"expiracion": "05/14/2016",
	"metodo": "Otro",
	"nombre": "David Ortiz / Nuevo",
	"objectId": "QNWWk2UsW4",
	"otro": "",
	"pago": 10,
	"pueblo": "Caguas",
	"servicio": "Cajas",
	"telefono": "117872048053 / 787-201-488",
	"ultimo_pago": "12/10/2015 1:54 PM ($50.00) - Awilda Hernandez",
	"unidades": 1,
	"updatedAt": "2015-12-10T17:56:39.813Z"
}, {
	"activo": true,
	"clave": "",
	"createdAt": "2015-05-24T23:57:43.057Z",
	"deuda": 0,
	"expiracion": "05/18/2016",
	"metodo": "Otro",
	"nombre": "Awilda Hernandez / Nuevo",
	"objectId": "aTlQ1ktH8v",
	"otro": "No Paga",
	"pago": 0,
	"pueblo": "Urb Delgado / Caguas",
	"servicio": "Cajas",
	"telefono": "219392421118",
	"unidades": 1,
	"updatedAt": "2016-01-11T19:08:31.163Z"
}, {
	"activo": true,
	"clave": "",
	"createdAt": "2015-03-18T13:27:16.281Z",
	"deuda": 0,
	"expiracion": "05/27/2016",
	"metodo": "Personal",
	"nombre": "Javier Rivera / Nuevo",
	"objectId": "nTsMj4g0Ui",
	"otro": "",
	"pago": 10,
	"pueblo": "Hormigas, Caguas",
	"servicio": "Cajas",
	"telefono": "017876448852",
	"ultimo_pago": "2/27/2016 8:59 PM ($30.00) - Yai Toro",
	"unidades": 1,
	"updatedAt": "2016-02-28T00:59:23.928Z"
}, {
	"activo": true,
	"clave": "",
	"createdAt": "2015-05-18T00:49:01.768Z",
	"deuda": 0,
	"expiracion": "05/27/2016",
	"metodo": "Personal",
	"nombre": "Javier Rivera / Nuevo",
	"objectId": "3Hqwozt9YS",
	"otro": "",
	"pago": 10,
	"pueblo": "Hormiga, Caguas",
	"servicio": "Cajas",
	"telefono": "117876448852",
	"ultimo_pago": "2/27/2016 8:59 PM ($30.00) - Yai Toro",
	"unidades": 1,
	"updatedAt": "2016-02-28T00:59:49.752Z"
}, {
	"activo": true,
	"clave": "",
	"createdAt": "2015-03-21T03:03:08.015Z",
	"deuda": 0,
	"expiracion": "05/30/2016",
	"metodo": "Personal",
	"nombre": "Winston Gonzalez / Nuevo",
	"objectId": "1RlH9J9iO2",
	"otro": "",
	"pago": 10,
	"pueblo": "El Verde, Caguas",
	"servicio": "Cajas",
	"telefono": "017876075772",
	"ultimo_pago": "11/30/2015 11:41 AM ($60.00) - Awilda Hernandez",
	"unidades": 1,
	"updatedAt": "2015-11-30T15:43:46.332Z"
}, {
	"activo": true,
	"clave": "",
	"createdAt": "2015-05-10T23:14:44.212Z",
	"deuda": 0,
	"expiracion": "05/30/2016",
	"metodo": "Otro",
	"nombre": "Luis Cesar Lozada / Nuevo",
	"objectId": "tVs72B2aXb",
	"otro": "???",
	"pago": 10,
	"pueblo": "Las PIedras , Publito Del Rio",
	"servicio": "Cajas",
	"telefono": "017879127674",
	"ultimo_pago": "11/30/2015 12:03 PM ($60.00) - Awilda Hernandez",
	"unidades": 1,
	"updatedAt": "2015-11-30T16:04:02.562Z"
}, {
	"activo": true,
	"clave": "",
	"createdAt": "2015-05-31T00:42:17.016Z",
	"deuda": 0,
	"expiracion": "05/30/2016",
	"metodo": "Personal",
	"nombre": "William Jimenez / Nuevo",
	"objectId": "pdAys2FgkV",
	"otro": "",
	"pago": 90,
	"pueblo": "Pase Del Rio Caguas",
	"servicio": "Cajas",
	"telefono": "019396456221 / 787-547-4885",
	"ultimo_pago": "5/30/2015 9:31 PM ($90.00) - Yai Toro",
	"unidades": 1,
	"updatedAt": "2015-05-31T01:31:51.239Z"
}, {
	"activo": true,
	"clave": "",
	"createdAt": "2015-03-13T07:54:54.678Z",
	"deuda": 0,
	"expiracion": "06/03/2016",
	"metodo": "Personal",
	"nombre": "Sixto Rivera Negron/ Nuevo",
	"objectId": "1EKcVwX5ma",
	"otro": "",
	"pago": 10,
	"pueblo": "Las Carolinas / Caguas",
	"servicio": "Cajas",
	"telefono": "017875973445",
	"ultimo_pago": "2/3/2016 7:34 PM ($40.00) - Awilda Hernandez",
	"unidades": 1,
	"updatedAt": "2016-02-04T00:04:59.638Z"
}, {
	"activo": true,
	"clave": "",
	"createdAt": "2015-03-22T14:12:15.452Z",
	"deuda": 0,
	"expiracion": "06/07/2016",
	"metodo": "Personal",
	"nombre": "Pedro Rosario / Cartero / Nuevo",
	"objectId": "AwaK0q0TnP",
	"otro": "",
	"pago": 10,
	"pueblo": "Las Piedras",
	"servicio": "Cajas",
	"telefono": "019395790659",
	"ultimo_pago": "12/7/2015 7:05 PM ($40.00) - Flor Rivera",
	"unidades": 1,
	"updatedAt": "2015-12-07T23:06:21.105Z"
}, {
	"activo": true,
	"clave": "",
	"createdAt": "2015-03-23T01:00:56.682Z",
	"deuda": 0,
	"expiracion": "06/11/2016",
	"metodo": "Otro",
	"nombre": "Awilda Hernandez / Nuevo",
	"objectId": "X2y92pTY9G",
	"otro": "No Paga",
	"pago": 0,
	"pueblo": "Urb, Delgado, Caguas",
	"servicio": "Cajas",
	"telefono": "019392421118",
	"unidades": 1,
	"updatedAt": "2016-02-11T14:05:21.678Z"
}, {
	"activo": true,
	"clave": "",
	"createdAt": "2015-05-17T22:02:36.138Z",
	"deuda": 0,
	"expiracion": "06/11/2016",
	"metodo": "Otro",
	"nombre": "Awilda Hernandez / Nuevo",
	"objectId": "xNMwYMjDUN",
	"otro": "No paga",
	"pago": 10,
	"pueblo": "Urb Delgado, Caguas",
	"servicio": "Cajas",
	"telefono": "119392421118",
	"unidades": 1,
	"updatedAt": "2016-02-11T14:05:51.122Z"
}, {
	"activo": true,
	"clave": "",
	"createdAt": "2016-01-11T20:39:36.295Z",
	"deuda": 0,
	"expiracion": "06/13/2016",
	"metodo": "Otro",
	"nombre": "Angel Ramos Salgado / Nuevo",
	"objectId": "2zZPtAq7lY",
	"otro": "",
	"pago": 10,
	"pueblo": "Jose Mercado caguas",
	"servicio": "Cajas",
	"telefono": "017872400009 / 787-632-636",
	"ultimo_pago": "2/13/2016 6:50 PM ($40.00) - Yai Toro",
	"unidades": 1,
	"updatedAt": "2016-02-13T22:50:23.361Z"
}, {
	"activo": true,
	"clave": "",
	"createdAt": "2015-03-13T07:54:54.896Z",
	"deuda": 0,
	"expiracion": "06/20/2016",
	"metodo": "Correo",
	"nombre": "Heriberto Flores Rivera / Nuevo",
	"objectId": "rNWIGWQdaz",
	"otro": "",
	"pago": 10,
	"pueblo": "San Lorenzo",
	"servicio": "Cajas",
	"telefono": "017877360135 / 787-205-3015",
	"ultimo_pago": "10/31/2015 9:33 PM ($60.00) - Yai Toro",
	"unidades": 1,
	"updatedAt": "2016-01-20T21:54:08.616Z"
}, {
	"activo": true,
	"clave": "",
	"createdAt": "2015-03-20T18:17:09.447Z",
	"deuda": 0,
	"expiracion": "06/22/2016",
	"metodo": "Otro",
	"nombre": "Antonio J Arce / Nuevo",
	"objectId": "dD28cygXM6",
	"otro": "Paypal 02/25/16 le di un crédito de mas en raza cuando pague en marzo no darcel",
	"pago": 10,
	"pueblo": "Tomas de Castro, Caguas",
	"servicio": "Cajas",
	"telefono": "017874725894",
	"ultimo_pago": "2/25/2016 9:34 PM ($10.00) - Yai Toro",
	"unidades": 1,
	"updatedAt": "2016-02-26T01:36:17.907Z"
}, {
	"activo": true,
	"clave": "",
	"createdAt": "2015-03-22T14:10:01.269Z",
	"deuda": 0,
	"expiracion": "06/29/2016",
	"metodo": "Otro",
	"nombre": "Jesus Diaz / Don Chu / Nuevo",
	"objectId": "NcLGYkdkBu",
	"otro": "???",
	"pago": 10,
	"pueblo": "San Lorenzo",
	"servicio": "Cajas",
	"telefono": "017877367647",
	"ultimo_pago": "6/17/2015 7:57 PM ($120.00) - Flor Rivera",
	"unidades": 1,
	"updatedAt": "2015-10-29T18:57:49.733Z"
}, {
	"activo": true,
	"clave": "",
	"createdAt": "2015-05-17T19:40:55.783Z",
	"deuda": 0,
	"expiracion": "06/29/2016",
	"metodo": "Otro",
	"nombre": "Jesus Diaz / Don Chu / Nuevo",
	"objectId": "tqUA9jpa7o",
	"otro": "???",
	"pago": 10,
	"pueblo": "San Lorenzo",
	"servicio": "Cajas",
	"telefono": "117877367647",
	"ultimo_pago": "6/17/2015 7:57 PM ($120.00) - Flor Rivera",
	"unidades": 1,
	"updatedAt": "2015-10-29T18:58:21.129Z"
}, {
	"activo": true,
	"clave": "",
	"createdAt": "2015-03-13T07:54:55.309Z",
	"deuda": 0,
	"expiracion": "08/04/2016",
	"metodo": "Personal",
	"nombre": "Eddie Jimenez / Nuevo",
	"objectId": "LGrYiEwtga",
	"otro": "",
	"pago": 10,
	"pueblo": "Boneville, Caguas",
	"servicio": "Cajas",
	"telefono": "017875257316",
	"ultimo_pago": "2/4/2016 7:31 PM ($60.00) - Yai Toro",
	"unidades": 1,
	"updatedAt": "2016-02-04T23:31:23.723Z"
}, {
	"activo": true,
	"clave": "",
	"createdAt": "2015-05-17T21:55:34.450Z",
	"deuda": 0,
	"expiracion": "08/04/2016",
	"metodo": "Otro",
	"nombre": "Junior Mi Pai / 517763",
	"objectId": "iEJZn1xs7n",
	"otro": "No Paga, Papa Yamil",
	"pago": 0,
	"pueblo": "Valle Tolima, Caguas",
	"servicio": "Cajas",
	"telefono": "117873602250",
	"unidades": 1,
	"updatedAt": "2016-01-29T02:06:04.140Z"
}, {
	"activo": true,
	"clave": "",
	"createdAt": "2015-03-13T07:54:55.756Z",
	"deuda": 0,
	"expiracion": "08/11/2016",
	"metodo": "Otro",
	"nombre": "Junior Mi Pai / 517762",
	"objectId": "sDOoJE9h1y",
	"otro": "No Paga, Papa Yamil",
	"pago": 0,
	"pueblo": "Valle Tolima, Caguas",
	"servicio": "Cajas",
	"telefono": "017873602250",
	"unidades": 1,
	"updatedAt": "2016-01-29T02:05:16.457Z"
}, {
	"activo": true,
	"clave": "",
	"createdAt": "2015-07-16T16:47:27.210Z",
	"deuda": 0,
	"expiracion": "08/16/2016",
	"metodo": "Otro",
	"nombre": "Angel L Analla",
	"objectId": "UIIQQ0VUGh",
	"otro": "",
	"pago": 10,
	"pueblo": "Bo.Sud Cidra",
	"servicio": "Cajas",
	"telefono": "017876371976",
	"ultimo_pago": "9/17/2015 11:43 AM Acreditado 1 mes - Awilda Hernandez",
	"unidades": 1,
	"updatedAt": "2015-09-17T15:47:01.959Z"
}, {
	"activo": true,
	"clave": "",
	"createdAt": "2015-05-25T23:33:39.982Z",
	"deuda": 0,
	"expiracion": "08/19/2016",
	"metodo": "Otro",
	"nombre": "Elliot Melendez",
	"objectId": "ych34vSB7r",
	"otro": "???",
	"pago": 10,
	"pueblo": "Carr #31 / Juncos",
	"servicio": "Mach Tv",
	"telefono": "+1 (787) 643-1089",
	"ultimo_pago": "1/15/2016 12:51 PM ($60.00) - Yai Toro",
	"unidades": 1,
	"updatedAt": "2016-01-15T16:52:07.757Z"
}, {
	"activo": true,
	"clave": "",
	"createdAt": "2015-09-09T02:04:49.253Z",
	"deuda": 0,
	"expiracion": "09/18/2016",
	"metodo": "Otro",
	"nombre": "Evelyn Carrion / Nuevo",
	"objectId": "SS9EyFTAqq",
	"otro": "",
	"pago": 10,
	"pueblo": "Las Piedras",
	"servicio": "Cajas",
	"telefono": "017873982824",
	"unidades": 1,
	"updatedAt": "2016-01-18T13:22:08.612Z"
}, {
	"activo": true,
	"clave": "",
	"createdAt": "2015-07-25T15:13:38.284Z",
	"deuda": 0,
	"expiracion": "09/29/2015",
	"metodo": "Otro",
	"nombre": "Leandro Almonte / Nuevo",
	"objectId": "hnkITtNPI1",
	"otro": "???",
	"pago": 10,
	"pueblo": "Bayamon",
	"servicio": "Cajas",
	"telefono": "017872460604",
	"ultimo_pago": "8/29/2015 5:50 PM Acreditado 1 mes - Yai Toro",
	"unidades": 1,
	"updatedAt": "2015-08-29T21:51:57.592Z"
}, {
	"activo": true,
	"clave": "",
	"createdAt": "2015-03-22T13:33:15.283Z",
	"deuda": 0,
	"expiracion": "1/1/2016",
	"metodo": "Correo",
	"nombre": "Manuel Jimenez / 407254",
	"objectId": "6UsiJFhPPs",
	"otro": "",
	"pago": 10,
	"pueblo": "Fajardo",
	"servicio": "Cajas",
	"telefono": "117875164140",
	"ultimo_pago": "5/8/2015 8:06 PM ($70.00) - Yai Toro",
	"unidades": 1,
	"updatedAt": "2015-05-09T00:07:36.940Z"
}, {
	"activo": true,
	"clave": "",
	"createdAt": "2015-07-31T16:01:16.443Z",
	"deuda": 0,
	"expiracion": "1/1/2016",
	"metodo": "Otro",
	"nombre": "Dario Almonte / Nuevo",
	"objectId": "vhjqKFawpc",
	"otro": "",
	"pago": 10,
	"pueblo": "Puerto Nuevo",
	"servicio": "Cajas",
	"telefono": "017876475775",
	"ultimo_pago": "8/30/2015 11:31 AM ($30.00) - Yai Toro",
	"unidades": 1,
	"updatedAt": "2015-08-31T14:39:24.664Z"
}, {
	"activo": true,
	"clave": "",
	"createdAt": "2015-10-14T22:17:56.163Z",
	"deuda": 0,
	"expiracion": "1/1/2016",
	"metodo": "Otro",
	"nombre": "Carlos Perez",
	"objectId": "ZqIFR30hyr",
	"otro": "",
	"pago": 15,
	"pueblo": "Cidra",
	"servicio": "Roku",
	"telefono": "+1 (787) 205-3842",
	"ultimo_pago": "12/1/2015 7:04 PM ($15.00) - Flor Rivera",
	"unidades": 1,
	"updatedAt": "2015-12-01T23:04:17.577Z"
}, {
	"activo": true,
	"clave": "",
	"createdAt": "2015-10-31T18:19:34.647Z",
	"deuda": 0,
	"expiracion": "1/1/2016",
	"metodo": "Otro",
	"nombre": "Erick Rodrigguez / Nuevo",
	"objectId": "s3YamAHR5X",
	"otro": "",
	"pago": 10,
	"pueblo": "Gurabo",
	"servicio": "Cajas",
	"telefono": "017874691783",
	"ultimo_pago": "12/1/2015 11:11 AM ($10.00) - Awilda Hernandez",
	"unidades": 1,
	"updatedAt": "2015-12-01T15:11:48.023Z"
}, {
	"activo": true,
	"clave": "",
	"createdAt": "2015-10-31T18:21:33.117Z",
	"deuda": 0,
	"expiracion": "1/1/2016",
	"metodo": "Otro",
	"nombre": "Erick Rodriguez / Nuevo",
	"objectId": "GRHGZEzlsL",
	"otro": "",
	"pago": 10,
	"pueblo": "Gurabo",
	"servicio": "Cajas",
	"telefono": "117874691783",
	"ultimo_pago": "12/1/2015 11:11 AM ($10.00) - Awilda Hernandez",
	"unidades": 1,
	"updatedAt": "2015-12-01T15:11:55.555Z"
}, {
	"activo": true,
	"clave": "",
	"createdAt": "2015-10-31T18:22:24.453Z",
	"deuda": 0,
	"expiracion": "1/1/2016",
	"metodo": "Otro",
	"nombre": "Erick Rodriguez / Nuevo",
	"objectId": "IC2DlzobTK",
	"otro": "",
	"pago": 10,
	"pueblo": "Gurabo",
	"servicio": "Cajas",
	"telefono": "217874691783",
	"ultimo_pago": "12/1/2015 11:12 AM ($10.00) - Awilda Hernandez",
	"unidades": 1,
	"updatedAt": "2015-12-01T15:12:05.940Z"
}, {
	"activo": true,
	"clave": "",
	"createdAt": "2015-10-31T18:23:18.352Z",
	"deuda": 0,
	"expiracion": "1/1/2016",
	"metodo": "Otro",
	"nombre": "Erick Rodriguez / Nudevo",
	"objectId": "tBhjT7ZnOY",
	"otro": "",
	"pago": 10,
	"pueblo": "Gurabo",
	"servicio": "Cajas",
	"telefono": "317874691783",
	"ultimo_pago": "12/1/2015 11:12 AM ($10.00) - Awilda Hernandez",
	"unidades": 1,
	"updatedAt": "2015-12-01T15:12:13.151Z"
}, {
	"activo": true,
	"clave": "",
	"createdAt": "2015-10-31T18:24:15.039Z",
	"deuda": 0,
	"expiracion": "1/1/2016",
	"metodo": "Otro",
	"nombre": "Erick Rodriguez / Nuevo",
	"objectId": "JwwEMqh3ak",
	"otro": "",
	"pago": 10,
	"pueblo": "Gurabo",
	"servicio": "Cajas",
	"telefono": "417874691783",
	"ultimo_pago": "12/1/2015 11:12 AM ($10.00) - Awilda Hernandez",
	"unidades": 1,
	"updatedAt": "2015-12-01T15:12:20.130Z"
}, {
	"activo": true,
	"clave": "",
	"createdAt": "2015-12-01T19:43:51.224Z",
	"deuda": 0,
	"expiracion": "1/1/2016",
	"metodo": "Paypal",
	"nombre": "Alejandro Zapata Echevaria / PIX00 /cliente lo va a cambiar a Mach",
	"objectId": "wYCKsjbl7I",
	"otro": "",
	"pago": 15,
	"pueblo": "Florida USA",
	"servicio": "Pix",
	"telefono": "*787-630-6882",
	"unidades": 1,
	"updatedAt": "2015-12-30T17:32:59.463Z"
}, {
	"activo": true,
	"clave": "",
	"createdAt": "2015-05-08T19:28:26.776Z",
	"deuda": 0,
	"expiracion": "1/10/2016",
	"metodo": "Otro",
	"nombre": "Francisco Rivera (CICO) Nuevo",
	"objectId": "WaJe7LrQv6",
	"otro": "",
	"pago": 10,
	"pueblo": "Aguas Buenas",
	"servicio": "Cajas",
	"telefono": "017875575477",
	"ultimo_pago": "10/6/2015 9:48 PM ($20.00) - Yai Toro",
	"unidades": 1,
	"updatedAt": "2015-10-07T01:48:01.661Z"
}, {
	"activo": true,
	"clave": "",
	"createdAt": "2015-11-10T17:02:42.533Z",
	"deuda": 0,
	"expiracion": "1/10/2016",
	"metodo": "Paypal",
	"nombre": "Jennifer Navarro / Cancelado temporeramente",
	"objectId": "vWnrlvsy7L",
	"otro": "",
	"pago": 10,
	"pueblo": "Fajardo",
	"servicio": "Pix",
	"telefono": "*7874050686",
	"ultimo_pago": "12/10/2015 10:49 AM ($10.00) - Flor Rivera",
	"unidades": 1,
	"updatedAt": "2016-01-12T17:07:45.823Z"
}, {
	"activo": true,
	"clave": "",
	"createdAt": "2015-03-23T01:02:44.059Z",
	"deuda": 0,
	"expiracion": "1/13/2016",
	"metodo": "Otro",
	"nombre": "Orlando Rivera / Suegro / 517777",
	"objectId": "T8rUhevdki",
	"otro": "No Paga",
	"pago": 0,
	"pueblo": "Aguas Buenas",
	"servicio": "Cajas",
	"telefono": "017875321589",
	"unidades": 1,
	"updatedAt": "2015-05-17T22:07:21.997Z"
}, {
	"activo": true,
	"clave": "",
	"createdAt": "2015-09-08T20:11:17.972Z",
	"deuda": 0,
	"expiracion": "1/13/2016",
	"metodo": "Otro",
	"nombre": "Luis Gonzalez Lopez / LuizGonzalez00",
	"objectId": "Ebid9v04qO",
	"otro": "",
	"pago": 10,
	"pueblo": "Humacao",
	"servicio": "Pix",
	"telefono": "**787-718-3858",
	"ultimo_pago": "11/23/2015 5:23 PM Acreditado 1 mes - Awilda Hernandez",
	"unidades": 1,
	"updatedAt": "2015-11-23T21:23:19.659Z"
}, {
	"activo": true,
	"clave": "",
	"createdAt": "2015-06-30T01:27:16.965Z",
	"deuda": 0,
	"expiracion": "1/13/2016",
	"metodo": "Personal",
	"nombre": "Maria Santiago / Tata Tum tum",
	"objectId": "ZuFd41f1zZ",
	"otro": "",
	"pago": 20,
	"pueblo": "El Pueblo Caguas",
	"servicio": "Internet 3M",
	"telefono": "+1 (939) 644-1027",
	"ultimo_pago": "12/13/2015 12:02 PM ($20.00) - Yai Toro",
	"unidades": 1,
	"updatedAt": "2015-12-13T16:02:20.011Z"
}, {
	"activo": true,
	"clave": "",
	"createdAt": "2015-07-09T21:16:13.528Z",
	"deuda": 0,
	"expiracion": "1/13/2016",
	"metodo": "Personal",
	"nombre": "Maria Santiago / Tata Tum Tum / Nuevo",
	"objectId": "nNQiWKWr4Q",
	"otro": "",
	"pago": 10,
	"pueblo": "El Pueblo , Caguas",
	"servicio": "Cajas",
	"telefono": "019396441027",
	"ultimo_pago": "12/13/2015 12:02 PM ($10.00) - Yai Toro",
	"unidades": 1,
	"updatedAt": "2015-12-13T16:02:15.293Z"
}, {
	"activo": true,
	"clave": "",
	"createdAt": "2015-09-15T17:55:29.744Z",
	"deuda": 0,
	"expiracion": "1/15/2016",
	"metodo": "Otro",
	"nombre": "Kely Serrano",
	"objectId": "2UrUK7jIbV",
	"otro": "Fianza $100 Abono $50 Balance $50 08/05/15",
	"pago": 25,
	"pueblo": "Res. Juan Jimenez Caguas",
	"servicio": "Internet 3M",
	"telefono": "*787-678-1295",
	"ultimo_pago": "12/23/2015 9:48 AM Acreditado 1 mes - Yai Toro",
	"unidades": 1,
	"updatedAt": "2015-12-23T13:48:01.237Z"
}, {
	"activo": true,
	"clave": "",
	"createdAt": "2015-05-26T00:27:17.721Z",
	"deuda": 0,
	"expiracion": "1/16/2016",
	"metodo": "Ath Movil",
	"nombre": "Willie Colon / wilfredo colon",
